author,content
启月,我见别人说想开猫舍哪怕是为了谋利也会装模做样的说我喜欢猫咪会给他们好的生长环境而你堂而皇之的说你要如何如何我的天呐你至少要邀请做到了你说的这些个恶心人的条件的成功人来回答这个问题吧你邀请养猫的来看这种问题干嘛找骂吗你说你干的工作不喜欢养猫你喜欢还是说你愿意干这种丧良心的事要是这样比养猫挣钱的活多了干嘛嚯嚯猫呢小猫有一点问题都活不过来的我也没钱我也不愿意买高价猫但是我更不愿意见到猫贩子把一个月不到的小猫断奶就拿出来卖现在大冷天的就因为再养就死在手里了有一句那些个猫贩子们真是请求你们给猫打好疫苗天天消毒猫舍对猫好一点了解一些什么叫猫瘟吧都有什么传染病还很快一大群呢一个有病一死一窝的贩子从来不会看病的做个人吧
ThesixLGD,老哥儿你要是带着这种认知去开猫舍最后会连怎么赔的都搞不清楚的
幻灭之光,做好科学调查当然是可以的看你语气想把猫当猪养也行但是科学养殖需要的卫生条件你有吗科学养殖可不是个简单的事情具体怎么操作可以去东北那边学习一下大规模养殖需要什么东西就算你养出来怎么卖你有渠道吗当然自己去试试就行了多岁了就算失败也没啥问题
neilwang,少造孽你见过猫贩子怎么处理卖不出去的小猫吗你觉得几百块就卖出去很好你想过那帮买猫的人质疑猫血统吗互相恶心排挤就是这圈子的现状一窝小猫好看的被挑走不好看的怎么办干吃粮食就是成本为了省成本不好看的小猫死的都很惨真正赢利的猫贩圈是非常黑暗的你要是不想变成你自己讨厌的人就好好想想
太一,猫吃得多且贵猫容易得病猫繁殖不快猫容易死猫投资多品种贵种公种母参加比赛微博公众号买广告做宣传哪一笔不要银子还费心思成本高风险还大的猫舍运营你是咋总结的这么可爱的
刘小喵,你当养殖土鸡土猪
米粒,还是放过猫吧猫其实很脆弱的并不是不容易生病
安吉斯,别害猫了作为一个普通的养猫家庭只绝育猫我粗略算了一下在保证猫咪健康基本舒适的前提下每年开销左右这笔开销仅限吃喝拉撒少量营养品补充和玩具这是针对你说开销小只只可能不觉得很花钱数量一上去花销是真的不小但你做猫买卖连基本营养健康都不能保证的话那只会造成大量不健康猫咪治疗费用可是正常喂养猫的费用的好几十倍随便做个检查就千如果你不顾猫咪健康与否继续售卖那就是黑心贩子别造孽了哪行想要做好都要专业知识大量的金钱和精力的投入空手套白狼或者赚快钱的方式都写在刑法里
快乐的雪花,农村最不缺的就是猫猫狗狗
情意三千,可以但是如果是盈利目的建议你三思而行农村的流浪猫都没有
小狸奴布偶,我变成了一条狗你说了个啥养过两只猫有点粉丝就对宠物行业懂了可看着猫圈的跟风黑热点好蹭了是吧猫的价格不看长相你家猫丑就觉得别人家的猫不值钱赛级猫跟你家王德发在市场上一个身价话语权我是没觉得我一个注册资金一万块的个体工商户哪来的话语权狗子你给我的第一次听说话语权决定市场价值您市场营销专业课上学的吃个进口粮都铁憨憨猫舍大多也不卖猫粮啊骂虐猫的不该骂吗前一阵你还写了田园猫的回答说什么可以不爱请别伤害这会又说骂虐猫的又成铁憨憨了带什么节奏呢知道啥是血统吗能用点心去了解下嘛你说有人拿血统骗人没错你把真血统都否认了你几个心啊你把这些国际协会都端了呗或者你直接说这些协会是国际骗子集团呗猫多能生这种呈级数增长的东西也没见猫把地球占领啊指数呢光说生的快不说生不生的出来活不活得下去偷换啥概念呢按你说的生法母猫没几窝就废了可知道一个蓝猫崩盘了猫有多少品种知道么光英短这一种就十几个花色我给你说高端英短猫舍的蓝猫价格依然不便宜崩的都是低端好吧懂不懂啊按你的逻辑所有品种猫都该崩盘啊宠物活体市场大萧条啊所有猫都不如一袋猫粮值钱才对啊制造有缺陷的猫得嘞这顶大帽子扣的我再多说两句是不是该说我他急了他急了他心虚了是嘛您了解过遗传吗缺陷猫哪来的您先搜一搜说话讲道理别光带节奏这个话题下不少猫舍您去翻翻先找点证据再说好吗又说话语权我都没想到不就是品相标准么到您这还话语权了我们没啥话语权而是买家不是瞎子他要买的猫到底好看还是丑他用眼睛就能看出来懂吗人家花钱了为什么要买丑的很抱歉我就是对号入座了之前你一直带猫话题的节奏现在直接怼脸上来了可还行我不知道您是真不懂还是刻意跟风炒流量好好了解一下宠物活体行业跟你卖衣服不一样行吗真要希望别人幸福就少带节奏最后回答题主的问题就四个字异想天开
横公鱼泓渤,去年我买了一只猫崽子猫瘟加疱疹林林总总加上无辜受累的另一只的治疗费防传染的猫瘟针三针俩花了一共小一万这俩还都传染一个得病连带一窝基本得上你要说繁殖想完全避免这俩从种公种母猫舍消毒每日喂食提高体质就得海了钱了奔后院也已经错过入行时间了大兄弟今年我看着收益都在低坐标辽宁沈阳建议先了解一下后院猫狗的概念后院猫狗这两年在各处遭遇疯狂抵制主要这玩意从人道主义出发有的后院确实太丧良心了但这行业丧良心挣钱快啊摸摸你的良心问问自己还想不想要他想要的话这个真不太挣钱入行要谨慎光沈阳的我同城闲鱼瞎看已经看俩猫舍今年挂了出清呢顺手收了点用品毕竟家里仨猫日常用的上至于捡便宜买猫种公种母也不便宜均价还是万起最便宜的有五千的需捡漏蹲守也要看运气讲真你的想法不太适合进这行建议先认真研究了养猫咋养算性格好身体好定位好客户群然后再考虑干这个不然说白了要是养的不好即使没夭折在手里也不好卖你的想法其实建议养鹅之类的祝好
漂亮的小瘦子,这是钓鱼吗我虽然不懂养猫可是也知道猫舍里面卖的起价都是品种猫啊品种猫有些有遗传病这个谁不知道而且品种猫要配种也要给钱的啊价格还不低更何况我从来没听说过在农村里收猫农村里的猫主要是田园猫别人凭什么花几百块钱钱买田园猫啊想要找个人要都要得到还可以捡流浪猫
有点儿不知所谓,猫舍可以开但不适合农村
小北北,绝对可以不管是什么猫繁殖能力都超强没必要理会高赞的阴阳怪气高档猫舍有高档猫舍的品牌溢价便宜猫舍有便宜猫舍的市场可以搞起来
平淡,据说鞍山的布偶猫在上海能你自己养不如倒卖
Jason chan,你想得太简单啦首先农村的选址租金怎样猫猫的来源猫是纯种的还杂种的猫砂猫粮装修费你说猫猫生病少但万一生病了呢你会不会简单地治疗万一是传染病你没有及时发现你整个猫舍都染了怎么办人家的猫卖几千块是因为人家把上面的问题解决了加上品种猫才这么贵的你卖人几百块解决上面列出的问题加上品种猫卖几百块你内裤都赔给人家来了你在农村开就是租金少点而已其他成本没有少啊
唯二非逐流,了还这么没脑子也难怪混成这样了养猫专业户如果真能成为啥现在市面上还没有呢猫是大爷不是猪不是鸡只要你辛苦点就能养起来了宠物猫还不同于梨花猫随便吃一点什么就可以了要吃猫粮要防疫要定期检查这些都是基本的吧另外是个猫就能当宠物猫吗虽说好心人多了但还不够多不然为何很多小区都有流浪猫出现呢不好看的不可爱的出身不名贵的也没那么多人养况且真正的爱心人士都领养代替购买了
CLRan,我觉得你这种很常见欸跟猫狗市场一样你的创意肯定有别人做过了建议还是转行吧
老猫,自己养的是碰瓷三花猫养了猫以后也和有猫的人聊聊看着人家一只的卖可轮到你就知道卖出去不容易的没开过猫舍只知道生意不好做
黄小明,行行好放过那些猫吧也给你自己积点儿德四十多岁了怎么还那么幼稚猫都没养过给你只小猫估计你连公母都分不出来那么请问是谁给你的勇气就想开猫舍赚钱梁静茹嘛
uglywxf,不要害自己也不要害猫
ddd,不是本村的建议您在家躺好
流刃落兮,看了看评论一股脑的抨击不是住的不好了就是吃的不行要不然就是我肯定不买要是真像你们说的这么简单这中国得饿死多少猫贩子啊流浪猫的问题可能也解决了吧成本和利润永远是相对的关系就算你们再怎么鼓吹领养代替购买也没法磨灭低端市场对领养猫的歧视知乎人均一只猫起步不知道的还以为猫在中国是什么奢侈品可能回到盛唐时期才能物以稀为贵吧几百块一只猫完美符合了低端市场欺骗自己的心理需求抛弃起来也不会有太大的心里负担对钱包也没有太大的压力也有答主给出了削减成本的办法建议各位猫奴每天给自己的猫上一炷香磕三个头好体现出自己的爱心做个不太恰当的比喻神像在工厂里叫活送到商店里叫货你买回家才叫神各位搁这用拜神的态度来要求工厂生产之前也对着木头磕三个头可真是搞笑嗷
圆梦小生,不是太可行农村市场还是有待发展的
果子,你这想法首先就不端正你想养好猫你认为不花钱你以为什么猫都卖好几千还有你有什么渠道来推销你的猫么猫多了一个有病全部会传染漂亮的猫不止吃猫粮的天天护理喂零食营养餐打针吃药哪个不要钱人家真花几千上万买也是天天吃罐头的猫不是你在乡下养的毛不亮眼不明臭烘烘的猫
一一,醒醒你以为养猫是种土豆
妖倾夜,不太可行因为过不了多久你的猫大多会变成野猫乡下农村这种真的是环境使然小时候我家养了只猫按理说从小养大不短它吃喝可后来不知怎么它就不怎么回家了经常在外面野过了好几个月无意中在祠堂附近看见它了我纳闷了咦这花猫瞅着有点眼熟啊怎么那么像我们家养的那只因为它肥肥的胖了一圈我快认不出来了但是它真的再没回来过
想吃榴莲,农村野猫不够多么
朕不懂啊,你这样的后院猫舍是真的不太灵没有专业知识猫的健康得不到保障还有就是你知道一只种猫要多少钱吗还十来对干好自己本业吧
伊城,不可行作为一个有过这个想法并且去实验过的人我以我的经历告诉你成本一点也不低问题有哪些呢我从最开始的给你算算首先开猫舍得有哪些东西空间猫猫粮猫砂猫笼猫砂盆保暖物空调热的地方药物益生菌以上都以最基础的考虑至于需要什么样的和原因我在下面回答你空间空间是最基础的养猫的空间不需要非常大但是一定得有足够的空间至少能摆下两个两到三层的笼子而且猫要能活动因为不可能一直关着猫这个空间还有个什么需求得和外界隔离家养猫咪一般不容易得病但是如果放养在外面的话会有几率感染狂犬病等等最重要的是如果放养猫跑了怎么办而且一定要能有两个隔间群养猫咪最容易群体性感染猫藓猫鼻支一旦出现时需要能够隔离不然后续治疗的费用可以让你几年都回不上本猫首先要想猫能卖得出去种猫都必须得好就算是现在市场上相对便宜的暹罗和蓝猫他们的种猫价格也不菲少说点你就算去东北淘猫运费加猫本身费用一堆堆算下来至少也要还只是一只要做猫舍的话规模化运营你最少得要公母到这里你以为就完了不运回来之后体检啥的检查下来一只都得多而且种猫一般从幼猫买起最大四五个月吧人顶多给你包两针疫苗按进价买疫苗都得一针你如果要保险的话还得每只打三针种公种母一般等到个月大才能交配但是种种母个月就发情了乱撒乱尿你还得打扫还得把公猫和母猫们隔开每天还得保持环境干净还得做好隔音猫发情时会乱叫你还得保证你的邻居不投诉你小猫生出来后从出生到能卖出去假如你的猫每批生均数四只最少得养到个月左右打完一针疫苗又是每只母猫生完孩子还得休养五六个月才可以再生种公种母每只的工作年龄顶多年还得是身体非常好的之后你又得换小猫如果生的不好看呢你是不是还得养着不然弃养吗还有如果你家母猫一次产儿只生一只呢这都是得想到的而且种猫服役完后你要么得低价甩卖要么就得留着自己养还不是又是一笔开销猫粮打他国产还能喂的猫粮元斤别跟我说元一斤的那种和喂大米饭没啥区别猫咪可能会出现些你意想不到的情况幼猫个月以下每天克成猫每天克就我家当时九只猫一袋的猫粮喂不到两周你又是要做猫舍前期一个月的猫粮可能多就搞定了但是后期假如出生四只小猫一个月千位数的开支都不在话下而且幼猫出生初期母猫一天需要的营养量有克左右如果有个别营养不良的猫咪还得人工补充羊奶如果猫咪得猫藓还得定时补充赖氨酸增加营养补充那么你觉得回本吗猫砂就像我们用一袋的猫砂最劣质的最便宜的元一袋单只猫每隔两周就得换一袋如果猫舍的话一周得用最少两到三袋猫笼像我买的猫笼两层的高的多最少两个的话得左右如果母猫生孩子时你还得买繁育包就算不买那干净的纸箱抹布总得弄点的吧小猫生出来后总要有保暖物的吧猫砂盆半封闭猫砂盆一般就一个你至少得备个但是这种猫砂盆猫埋便便时很容易弄的一地都是得每天打扫全封闭猫砂盆最低一个同样需要备个虽然猫砂不会洒但是这种盆味道大你得每天打扫保暖物空调保暖物不等当然你可以用草墩空调的话如果当地夏天很热你还是得装不然一个屋子都是猫毛很影响环境顾客如果看到的话也是很影响他买的心情的而且如果房间过于热的话就像人会得痱子一样猫也可能得皮肤病严重的话还得去医院一次都是好几百药物益生菌驱虫药内驱外驱就算你用人用打虫药加上那种块的跳蚤药猫咪每隔个月左右就得吃驱虫药元一颗如果你想猫健康点还得买市面上专门用于猫狗的那个一两颗都是多猫咪得喂赖氨酸吧最基础的因为上述猫粮本身就很难提供足够营养了闲鱼上不知道真假的左右一盒还可能只够你的猫咪们吃两三天除此之外猫如果得猫瘟了呢如果鼻支感冒了呢如果得猫藓了呢随便一份药顶多够你喂一两次的也要多一份有的甚至多那么益生菌呢幼猫和种猫初到家需要加强免疫力且调理肠胃像我买的一盒够喂一只猫天而你是开猫舍还得喂很久你觉得支出会少吗讲道理你得考虑清楚养猫不是有只猫就能赚钱现在这个市面上赚钱的多数是猫贩子和无良猫商少数正规的赚到钱的也是开了年左右的老店了你去跟他们竞争比价钱你比不过猫贩子比信誉和口碑你比不过老店而且你也没有客户源挂网上卖还得人家看得上在周边卖那更不现实农村有多少人愿意消费你几百一只的猫我之前养的一窝养到能卖了砸进去多了到最后就卖出去三只每只还只敢喊剩下的三只实在没办法了还送人了所以与其做这行你还不如投资点其他的呢今年疫情又严重数据上说是宠物行业利润反增但实际上周边的人都怕的要死而且现在的人买猫都想低价买好猫你这种价再低长得不好看的话还是没人买很多人还不愿意出运费你又不能自己摊这笔钱不然直接亏死总而言之做生意这事不是听成功者成功了你就能成功多问问那些做这行失败过的亏过的你就会知道还是上班舒服
芭比蹄子,无人流不现实你是富二代随你
Elodia,其实感觉有点异想天开的味道农村根本就没有正规的宠物医院而且不太会养品种猫免费朋友家拿的可爱土猫它不香吗想养这种品种猫的一般都是年纪轻轻的那种而且是经济独立且独居的那种但人家都住在城里年纪小经济不独立的家里人同意养只小土猫已经很不错了说的现实一点我妈他们都觉得养只中华田园猫还能抓抓老鼠那种品种猫只能拿来供着了
海涛,可行啊只要你有资金投入量就可以以我家为例养猫年做宠物产品两年之后才开始做涉足猫舍目前已经做了两年半总投入超过万以上今年刚刚开始有收入
原生鱼山乡大叔,可谓行行出状元这得取决于你自己意向与否没有什么可行不行的前题是你要有自己的爱好和养猫方面的知认专业人做专业事是可行的加油
晴天,完全可行部分答主就是太矫情我是来支招的你需要一个或者多个合伙人他们需要在城市开高端猫舍当然利润的大头也是他们拿养猫并不需要天天喂猫粮剩饭什么的就行然而卖猫不行卖猫前吃一个月猫粮培养习惯平时注意杀菌消毒灭虫防疫基本上投入不大很遗憾我没什么本钱不然咱们可以合伙
洛洛,二更评论区还跟我跳脚了养赶紧养谁不让你养我跟谁急我认识品相超好的猫一只三万我介绍给你题主信我五万品相三万价格童叟无欺绝不忽悠猫这玩意儿有口吃的就能活买几十套笼子扔院子里关起来随便生可好养了吃什么猫粮大米就能养很好哪个词儿叫什么来着哦对暴利开猫舍简直能赚翻别听我刚开始说的那是我怕你抢生意没想到被发现了原回答不可行吃得少确实吃得少不过猫多了吃的就多了我家只猫一天猫粮要一斤多渠道拿货均价一斤入门级进口粮如果你说喂十块左右的粮的话那我告诉你想多了疫情期间我喂过均价一斤的国产粮然后猫的医药费花了一万多就喂了一个多月当然也可以选择不救不过大几千一只的猫从小养大就眼看着去死么不易得病我觉得猫是最容易得病的宠物了换环境会应激吃不好分分钟生病密度大了应激压力大了应激出门应激总之生病的原因非常非常多哦你环境潮湿还会猫癣家中常备除湿机繁殖快是挺快的一胎只不过死亡率也挺高的我家猫借配的两只猫里面一只生了六只出了满月剩了两只身体奇差另一只直接难产去医院剖腹除了大猫一个不剩不易死得病率这么高你说容不容易死呢投资少猫从几百块到几十万都有请问同样的开销您打算做什么价格的
我爱团子,不可行自己市场调研一下再想想就知道了
阿尔卑斯爱土豆,我喜欢猫但是不喜欢让他和我一起生活让他回归自然不好么
Mark,你这种根本不爱猫单纯要以养猫赚钱最好不要开猫舍你的假设也不成立我家养猫很节省了一只猫一个月大概吃粮和用猫砂人民币我家猫是流浪猫身体很好一直也没生病完全在室内不出门因为只有一只没有啥交叉感染猫舍肯定养品质猫身体弱吃的要更好因为多猫环境会交叉感染医疗费用更高一句话养猫和养鸡不一样还养殖专业户你把猫当成鸡多待爱猫的人不会其实我的理想是开个慈善兽医诊所给流浪猫免费做绝育但是我实在怕见血学不了医家里也没那么有钱能做得了这么大的慈善
