author,content
门徒,作为全刷完的观众我想我还是有资格回答下的首先我会按照个人喜好给电影排序然后也会预测下各自的票房成绩希望读者们可以根据自我喜好观看避免雷区接下来长文预警五颗星我和我的家乡个人评分票房预估亿当然五颗星不是满分的意思只是在整个国庆档里它确实是观感最好也是最有卖相的基本就是国庆档最佳预定没想到我和我的系列到了第二年竟然还能拍的如此惊喜跟完满看我和我的家乡前其实我期待不高的毕竟这种命题作文尤其到了第二年大多是狗尾续貂但看完这部才发现整部电影的主题契合整体完成度笑点泪点以及演员们的表演都要远好过我和我的祖国要知道在我和我的祖国那部作品里某些导演的段落还是比较拉垮的五个故事基本上观感好的只有两三个但是在我和我的家乡里根本没有任何一个拉垮所有导演的所有段落都是笑中带泪所以全场两个半小时也是始终节奏高亢从头笑到尾而且笑完还带着泪当然如果让我排序下那就是北京你好回家之路神笔马良最后一课天上掉下个虽然排名有先后但整体效果都很棒只是其中有优秀跟更优秀罢了除外四颗星夺冠个人评分票房预测亿注定是个受争议的作品但是就算受争议个人觉得也比另外几个强一些按我个人观感相比我和我的家乡更喜欢夺冠但为了遵从大众的审美趣味那就把它放第二吧首先我知道陈可辛会拍知道巩俐黄渤会演知道电影质量不会差但还是没料到会拍的这么好全程两个多小时用三个时代女排串联起了郎平的平生更串联起女排精神中国发展的缩影看得我真是激情澎湃热血沸腾啊陈可辛真的真的太懂情绪表达了那些平行剪辑那些历史缩影那些比赛现场还原更重要的是巩俐跟黄渤角色间一生的交织跟扶持都浓缩在了电影它们浓缩的如此悄无声息以至于从彭昱畅到黄渤的过度从白浪到巩俐的过度是如此了无痕迹就如同现实中中国女排的样貌去拼搏去争取最后后半段主题的升华从为国家到为了自己那一声声的高亢那一声声的回响那一声声朱婷扣杀砸在对方地板上的重量让观众真的瞬间痛哭流涕啊真的太棒了至少我是喜欢的三颗星姜子牙个人评分票房预测亿说实话我个人还是蛮喜欢的不过我也理解大众两极化的评价确实从整体而言姜子牙观感不如哪吒让你能从开始笑到最后哭一路都能很嗨姜子牙以公路片这种结构呈现就注定了它对标的不可能是哪吒而有可能是大圣归来因为确实姜子牙情节设定挺老套基本跟大圣归来一个框架就是用公路片的形式以这种失落大叔与小孩的搭配组合完成自我救赎之旅这也是好莱坞电影的常见形式所以对姜子牙期待从头爽到尾的观众可能就要失望了因为它确实结构有些老套一些笑点制造也比较少再者就是情绪也不够饱满一些本该能将情绪烘上去的点比如跟小九告别比如斩断天梯这些主要的情感点呈现的太死板了大众基本上也猜到了这个结构惊喜感不够而且整体神话体系下也有一些经不起推敲还有就是一些台词设计痕迹有点重有可能让人出戏这些都让姜子牙不可能被大众很喜欢当然这也不说明姜子牙不好因为其实它完成度很高了无论是画面还是故事完整性都不错只是当我们以为它对标的是哪吒期待值过高就会导致这种落差感那为什么我喜欢姜子牙这方面跟我个人喜好有关我不太喜欢纯粹的喜剧爽剧作为一部电影我不希望它纯粹讨好观众而是应该有自己的命题表达在这方面姜子牙的命题很常见就是找寻自己甚至不惜背叛天道这种反套路的方式不为苍天为个人的叛逆是我觉得很不错的而且在整个呈现过程中它的呈现气质是很完整的而不是说哪吒为了迎合大众有太多花哨的设计比如哪吒师父的角色设计基本就是一个喜剧样板再比如刻意制造的敖丙跟哪吒这种讨巧的设计虽然会让观众嗨但过于喧宾夺主也会让人厌烦两颗星一点就到家个人评分票房预测亿其实呢两颗星也是可以的只是作为一部真人电影这种电影的设计真的太无聊太无趣了虽然前面有些笑点跟滑稽还有些小俏皮但是当后半段开始狂煽情开始围绕扶贫致富主题整部电影基本就跟闹着玩一样的创业全都崩碎了当然这个电影之所以差劲最大原因还是因为太赶了因为是疫情后开始拍摄的因为是命题作品因为要求十一必须上映可想而知剧组迫切程度演员也是从其他剧组挖来的比如彭昱畅就是在陈可辛那里拍完夺冠被推荐到这里陈可辛为该片监制譬如刘昊然也是在拍完我和我的家乡就来到了这里甚至这部电影主题跟地方还是刘昊然上个电影的云南就这你就能看出来导演组有多懒了吧所以不好看也是理所当然一颗星急先锋个人评分票贩预测亿你要问我如何评价它其实没什么评价的它既是一贯的成龙喜剧动作片这种动作喜剧你也知道差也不会差到哪里去而且这部作品成龙跟唐季礼周转多个国家多个城市拍摄风景旖旎视觉惊艳再加上成龙全球影响力实在太大基本到了哪个国家都会得到当地政府的帮助于是在这部片里哪些大场面高端武器也会让你看的目不暇接可以说也就是成龙能毫不费力拍出这样一部准好莱坞动作片如果你是国庆档图欢乐跟开心这个挺适合你的因为将近两个小时从头打到尾全程无尿点但就是太老套了成龙也只是走个过程难免有点困
朽木虬,十八线小城市家乡今天开预售一张姜子牙块往上营销方面家乡得天时地利人和做得很好但家乡是五月份才开拍的八月份还在赶做后期九月份上营销十月就提档非常得赶品质上个人不是很放心五个单元剧估计是良莠不齐观众会不会一直买帐不好说预估开画得益于优秀的营销及全明星阵容我和我的家乡票房会比姜子牙要高但若姜子牙成品质量达到哪吒百分之七十以上的质量能把所谓的封神宇宙立住脚给予国产动画电影信心的话靠口碑票房有逆转的可能如果只能二选一的情况下我个人站姜子牙已预购虽然几张票微不足道但是把钱花在姜子牙上面往后可能有更多优质的动画看况且明星名导们也不缺我这几十块票房当然品质优秀的情况下可以再蹲两张家乡
爱吃饭的书,国庆档当然是以合家欢和主旋律为主所以我和我的家乡将成为最高票房蛮巧合的是国庆档里面竟有三部都是春节档的夺冠姜子牙急先锋排除夺冠提前到月日先得到一个星期的票房保证按口碑来说决定了它将票房第二和第三之间至于其他两部姜子牙收获年轻群体估计是票房第二急先锋既然敢定档国庆档能够收获成本就不错了最后一部一点就到家似乎宣传力度不足不知道会不会挤压急先锋的票房呢你看刚说完就换档了看来知道自己的力量不足了
史努比喵喵,国庆档基本上每年都是几个关系户的菜鸡互啄最没看头的档期之一仅次于贺岁档
ggggeatl,姜子牙第一票房亿看预告片是大制作感觉导演是个认真的人不太可能像是个画面一流剧情三流的作品最大的问题是之前看导演采访觉得底气不足而且两次上映前一点点映都没有不知道是为了怕剧透失去悬念还是怎么的我和我的家乡亿去年我和我的祖国其实质量不咋地若不是周年这种片可能亿左右但是今年演员看上去阵容还是豪华而且故事比去年有创意夺冠亿体育类你不去电影院也知道它讲了个什么没啥看的欲望急先锋亿功夫瑜伽原班人马不用说什么了
影视胡青,这个国庆档期也是和中秋重合在一起的我和我的家乡这个立意完美符合这个档期并且第一个单元就是以中秋这个时间为背景拍摄的影片也是通过五个故事单元讲述了发生在中国东西南北中五大地域的家乡故事所以从这个前提下再加上全明星的制作应该来说会占据国庆档的头把交椅姜子牙号称是哪吒续集并且也是出现在了哪吒的彩蛋中因为哪吒的火爆积压了姜子牙的制作时间并且技术特效制作也外包了部分很可能会和哪吒有一些区别了哪吒的火爆主要在于天时地利人和暑期档凭借口碑很多家长都是带着小朋友二刷甚至三刷姜子牙很难达到这一点了夺冠我看很多人都在说它的票房会第一这是很难的从来体育题材就难得高票房并且你没走进电影院都知道他讲的是什么故事了吸引力是有限的另外它自己都没那么自信从国庆档提前到了上映就是为了避开部分竞争提前蓄口碑来争取排片和票房的
灯辉摇曳,我猜测我和我的家乡参考去年我和我的祖国毕竟去年我和我的祖国连学校工作单位都在宣传姜子牙参考去年中国机长我还是希望姜子牙高一点如果能够在剧情和立意上有所创新突破以及试听效果好感染力强成就流浪地球那样的神话也未必不可能就是这个前置条件好像有点苛刻姜子牙和我和我的家乡票房总和亿质量相等的情况下姜子牙略低夺冠参考去年攀登者并不意味着它不好人家只是面对神仙打架慌了提档说不定能捞个十几亿
马斯特 方,论口碑按照概率来说夺冠的陈可辛肯定是第一因为陈可辛他就应该最牛逼论豆瓣评分很可能是姜子牙第一近几年国漫画质七分保底剧情流畅八分不愁有人会问如果姜子牙豆瓣评分高为什么夺冠口碑会更好因为大多数喜欢电影和动画的人不会拿电影和动画相互比较可比性比较少而作为喜欢电影的我只会认为电影更好论票房不出意外应该还是我和我的家乡尽管捞钱迹象太过明显一点就到家新人导演直接上手喜剧这难度系数太高一个不小心就跪了
语法糖,夺冠基本退出国庆档冠军争夺了现在排片只有急先锋上座率目前只有如果今天结束上座率还是四个里面垫底的明天的排片估计会大降基本就走到头了夺冠如果能保持上座率排片估计会回到两位数但是在姜子牙和家乡的排片压制下估计也翻不出来大浪除非这两部质量过于拉跨看首日过后姜子牙和家乡的口碑情况我觉得姜子牙发挥正常水平国庆档冠军应该是稳了票房预测亿朝上
朱燊迪,个人觉得夺冠和姜子牙票房会更好一些首先看下电影的演员导演和类型一点就到家喜剧导演许宏宇主演刘昊然彭昱畅尹昉我和我的家乡个喜剧故事导演宁浩徐峥陈思诚闫非彭大魔邓超俞白眉黄渤葛优范伟邓超沈腾王宝强张占义徐峥闫妮马丽刘昊然刘敏涛卢靖姗王子文魏翔王砚辉章宇张译王源张一鸣王迅杨新鸣于和伟苗阜辣目洋子董子健张子贤陶虹吴京韩彦博佟丽娅吕行李晨孙俪赵铁人彭昱畅郝云杨紫岳云鹏赵海燕岳小军蔡蝶贾玲潘斌龙高睿菲儿王俊凯代乐乐黄才伦陈数梁超孙贵权雷佳音岳红陶亮刘炫锐张建亚张芝华韩昊霖李易峰许猛胡歌卫莱夺冠运动剧情导演陈可辛主演巩俐黄渤吴刚彭昱畅白浪陈展罗慧李冬徐马雪纯李紫微毛雯刘畅刘晨曦李阳一凌敏刘贞宏朱婷徐云丽张常宁姚迪林莉刘晓彤颜妮惠若琪丁霞袁心玥龚翔宇姜子牙动漫导演程腾李炜上面四部夺冠提档到月号了直接避免了最大的竞争是一个不错的决定可能可以拿下最高的票房吧再看其他三部姜子牙要和其他两部喜剧分开讲姜子牙是在哪吒后面饱受期待的一部电影宣发做得一直不错粉丝量基础很大有可能拿下四部中最好的票房而我和我的家乡五个小故事的电影不多见但是参与演员众多群众基础应该相当的不错不过类似电影并没有非常高的票房出现过很难猜一点就到家三个当红年轻男演员演的喜剧尤其是刘昊然强大的票房号召力票房应该很不错所以我最后我的结论是姜子牙和夺冠的票房应该可以争取第一的其他两部当然也很不错但就我个人而言可能不会首先去看第一部的话还是选择看姜子牙
倒计时,我觉得这将会是成龙的翻身之作刚开始热度不高但随着口碑发酵票房最终不会很低的而且会被打造成为一个成功的系列像警察故事一样成龙这几年确实拍了很多烂片可以明显看出他确实是老了打不动了所以想转型比如拍一些靠特技的片子靠表演的片子但这都不是他的优势所以片子质量低也是情理之中而这部急先锋就是安保公司靠打的这正是他的优势虽然他不能打了但打戏怎么拍没人比他更懂了用他的经验带动一群年轻演员拍动作片这是正确的路而且这批年轻演员里确实有几个有真功夫的比如综合格斗运动员杨建平先练武术后练泰拳的王彦龙加上唐季礼的执导我觉得相比花木兰和姜子牙之类的急先锋成为好片的几率更大些希望能通过这个系列多培养几个年轻的打星
frank jiang,不用怀疑争夺头位的只会是我和我的家乡和姜子牙
凯文,姜子牙我中间睡过去两次只能说技术好立意好可是剧本不行人物单薄矛盾太内化主创可能还是有些水土不服吧片尾两个彩蛋比正片更吸引我我和我的家乡值得一看特别是徐峥的最后一课和开心麻花的神笔马良一个是聪明的团队徐峥一个是默契的团队麻花输出了最成熟的感人和喜剧段落宁浩北京好人和陈思诚天上掉下个也算正常发挥但这两个故事的确牵强甚至一直让人担心的导演俞白眉邓超他们的回乡之路也没有拖后腿急先锋典型的成龙贺岁电影打的爽帅哥美女世界风景合家欢电影夺冠电影外的因素限制了导演的发挥但依然值得一看以上四部我的推荐顺序我和我的家乡夺冠急先锋姜子牙一点就到家还没看票房预测我和我的家乡亿夺冠亿急先锋亿姜子牙亿一点就到家亿补充题外话姜子牙里配角角色没有立好纣王存在的意义何在那个妖怪当铺的意义何在我和我的家乡居然没有用港台艺人急先锋最后的大拜年很有感触啊彭昱畅和黄渤的从夺冠延续到了我和我的家乡我和我的家乡中陈思诚导演的段落里佟丽娅拍的真美
陈·风暴烈酒,泻药十一期间准备出去玩没看电影不好判断先占个坑吧先说结论我感觉应该是我和我的家乡姜子牙一点就到家急先锋先说急先锋成龙大哥一直有基本盘但最近几年的低质量电影把他的口碑透支的差不多了年轻人怕是不会买他账只能吸点像我这样的后后了杨洋的粉丝估计也贡献不了几个钱再加上这个片子豆瓣评分崩盘我不看好这片子的票房撑死亿有可能亿都不到其实国庆期间最受期待的就是我和我的家乡姜子牙一点就到家三部电影在抖音上刷到三部电影的预告片了我个人比较喜欢我和我的家乡几个导演都是喜剧界的大牛这么多明星应该有不错的故事话说去年的我和我的祖国大部分新人导演其实都比陈凯歌导演的那个小故事拍的好我个人最喜欢徐峥和宁浩拍的小故事最主要的是电影主题比较适合国庆档我个人感觉这部电影的票房会最高姜子牙这种动画片任何时间段上映票房都不会很差首先是老少皆宜起码我们这些看东映皮克斯迪士尼梦工厂动画长大的一代是很能接受这些动画电影的而且我们这一代还都有小孩儿了不如带着孩子一起去看只要口碑不错票房成绩应该很可观刚才我看了一下姜子牙的豆瓣评分中规中矩吧不会令人太惊喜但也不失望我肯定会带着自己的孩子去看的所以我觉着这部戏的票房应该会仅次于我和我的家乡再接着是一点就到家首先表明我非常非常喜欢这三名主演新生代演员中我最喜欢的几个人是董子健刘昊然彭昱畅易烊千玺张一山尹昉胡先煦郭麒麟彭昱畅金马影帝提名董子健金马影帝提名刘昊然百花影帝提名易烊千玺金像影帝提名这帮新生代我不知道在更年轻的年轻人眼中怎么看反正在我这种后眼力是有票房号召力的彭昱畅的闪光少女快把我哥带走大象席地而坐夺冠我都看过绝对都是水准之上的表演而且还能扛票房令人惊讶的是这位新生代短短几年的时间就有了很高的国民度我身边同事不管是年轻还是不年轻的对他感官都不错最主要的是大部分都知道他这是很不容易的一件事刘昊然的唐人街探案系列让他拥有了极高的国民度妖猫传中的惊鸿一瞥简直惊艳尹昉的红海行动少年的你还有前段时间跟孙红雷拍的新世界也都有亮眼表现我觉得这小伙儿长得很像我当年很喜欢的一个香港明星叫安志杰不过他没安志杰的长相那么有攻击性很有味儿的长相非常适合文艺片我感觉这小伙以后戏路肯定要比安志杰广这三个人的电影只要口碑不崩我一定会支持但也仅此而已大概只要口碑不爆我不认为这电影的票房能超我和我的家乡姜子牙但超急先锋应该没啥问题
和世俗唱反调,总的来说姜子牙特效挺好的
茜茜王子,趁着双节放假把娃扔给我妈跟媳妇儿溜去看完了我和我的家乡今年电影院看的第一部电影值回票价笑中带泪的五个故事最后一课最感人神笔马亮最搞笑北京好人中规中矩天上掉下个点太多有点乱了回家的路结局反转有点尬邓超俞白眉的导演水平确实没啥进步之所以没去看姜子牙主要是时长就一个半小时减去头尾故事估计都讲不好我和我的家乡大概率就是国庆档的票房冠军了
冰镇汽水,夺冠题材和演员包括故事原型的路人盘都很大
徐富贵,这个还真不好说我猜是夺冠或者我和我的家乡姜子牙的话毕竟讲大人的动漫国内基本没有票房多好的一点就到家是什么
好好好,我预测夺冠票房最高亿亿我和我的祖国亿亿急先锋亿亿姜子牙亿亿一点到家亿亿坐等打脸忘了还有一个木兰动画片亿亿
张辰,夺冠我和我的家乡姜子牙姜子牙目前的趋势看可能会达不到预期夺冠稳稳的第一对于投资的话家乡更值得投资一个字稳
要求取名,有点期待我和我的家乡
k.k,夺冠
紫色基情,不出意外的话肯定是我和我的家乡票房最高全明星阵容主旋律献礼还有前期超强的宣发超多的排片姜子牙也许能跟这片子掰掰手腕但最终鹿死谁手我还是看好家乡
无妄无生任我行,这一届强者不算太多夺冠基本拉跨了第一应该会在姜子牙和急先锋之间产生当然我更倾向于姜子牙因为小孩好久没去看电影了
摄影师韧韧,预计夺冠会夺冠吧中国女排加影后巩俐不需要过多宣传就能让很多人进影院吧说不定还会得到官方的支持姜子牙国产动画片适合带娃去看到票房也不会低只不过这片是不是真的适合小朋友我还是持保留意见至少之前的哪吒剧情已经有些成人化了其他两部撞上夺冠和姜子牙可能营销方面要加加油
开不了口,姜子牙看口碑估计至少口碑好都有可能我和我的家乡捞钱迹象太明显了典型的捞钱片去年我和我的祖国还能收割一波爱国情怀这个我真不看好但是明星太多了票房应该也不会低估计吧夺冠左右一点就到家
明王镇狱,不出黑马的话姜子牙第一
水深火热的人生,来一个个人预测吧这四部片的最终票房排序我和我的家乡夺冠姜子牙一点到家
柒七叨,一群人都在凭自己的喜好在回答自己喜欢哪一部就说哪一部票房会高但其实大数据已经给出了答案不出意外票房最高的将会在姜子牙和我和我的家乡中产生急先锋和夺冠和这两部电影根本不是一个量级的
SweetheartRabbit,我猜我和我的家乡吧
国产麦克雷,本来觉得是我和我的家乡结果刚看完拉胯了现在认为是姜子牙因为我觉得这两年电影环境好多了票房是留给真正好电影的虽然还没看姜子牙但是我和我的家乡已经拉胯了至于其他的几部夺冠早几天上映应该就是怕干不过这两部吧最终也确实干不过急先锋我一看这个朱正延就觉得乐是不是拍的时候这哥还是流量现在从春节延到国庆流水的流量早就变了而且现在流量已经不好使了赶着提前一天上映估计也就是个一日游不信走着一点就到家彭昱畅还是可以的可是这个档期的两个对手我只能说可能性真的不大晚几天上映就算是到时候电影质量也好口碑也好都很难简单说下我和我的家乡拉胯得地方吧演员很好风景更好但是只值三星北京好人讲的是咱们老百姓也有医保卡了看病和北京人一样只能说愿望是美好的但生活不是春晚小品现实是农民工用的新农合只有在当地治不了给办了转院手续的情况下才能去大城市看病而且报销比例比当地人差很多最后报销的时候至少得去县里医院农合窗口吧村委会直接报销医保是什么操作这个故事编的很巧也很暖演员表演也没话说所以给半星吧这段的全名我都没记住因为真的看不懂导演想说什么带这么多好演员过来结果呜呜扎扎地王宝强还是一副唐人街探案的路子说话不好好说一副我智商低我骄傲的样子说句不客气的拍电影不是在那儿过家家起码都是真人真事吧拖拉机上边弄个风扇除了搞笑还有啥回家之路乔树林这个故事讲的是我们年轻人在外边发展的好了要记得建设家乡可是为什么一个抗沙的英雄要塑造成一个喜欢吹牛言行举止很拉胯的人呢乔树林一开始在飞机上的所作所为难道不是一个很讨厌的人吗难道最后反转了他是一个抗沙的好人就能提升什么吗这难道是什么高深的电影拍摄手法欲扬先抑正经人不配建设家乡这个叫俞白眉的编剧你这说是电影用的还是小品那副架子啊最后一课这个故事很感人人应该有感恩之心向每一个在贫困地区为教育事业做出贡献的人致敬一星神笔马亮立意和节奏都属上乘放在压轴正好扶贫确实是比上那个外国学校更伟大的事而且也是马亮真正想做的事然而一开始马亮的老婆并未意识到这个所以马亮在做伟大之事时竟然需要偷偷摸摸这值得我们反思正确的价值观是什么我们一定要做那些大家都觉得成功的事才算是成功吗一星半
杨静海,别的不想看一看到预告片里黄渤灰头土脸一扬脸油油夫欧哈哈决定了看他我和我的家乡
李梓树,我和我的家乡第一档某种意义上这是一个国庆狂欢式的电影名导名演员的组合能最大规模聚拢国庆期间不知道看什么的观众比如你对动画没有什么青睐对陈可辛和中国女排这个题材也没什么特殊感情换句话说你只是想看个电影在这三位面前家乡是卖相最好的姜子牙次半档哪吒珠玉在前神话宇宙的影响力已经有了但动画在传统电影面前有天然劣势除了动画爱好者之外多半观众群体还是会以青少年及其父母为主也不要过于乐观的评估哪吒的影响力夺冠再次半档这个半档是浮动的理论上和姜子牙在相同水准并且有和家乡平分秋色的卖相但考虑到中国神话宇宙和中国女排那段故事在当下号召力的不确定性放在这个位置最后很可能叫好但不那么叫座事实上最后的情况很可能是这三家平分秋色家乡比另外两位稳太多夺冠和姜子牙只要出几篇负面影评很可能大受打击但家乡的情况可以参照去年我和我的祖国即便白夜流星那一段被狂喷但其他几个篇章也能强行挽尊家乡的情况也类似一点就到家在前面三位面前竞争力弱了一筹是一部不适合在这个阶段参与竞争的电影
三无帐号,我和我的家乡去年我和我的祖国已经证明了多个导演组合的形式只要不是集体拉胯就是比单个导演单个故事票房号召强
拼六郎,预测一波国庆票房收入我和我的家乡急先锋姜子牙夺冠一点就到家我觉得急先锋会成为一个爆款唯一的一部动作片有成龙在场面和动作有保障即使龙叔已经多岁了仍然是动作片的保障同样影院已经很久没有一部让人肾上腺素飙升的电影了所以我觉得急先锋会成为这些片子中的一匹黑马
doctor尹,哪部票房高俺不知道我会去看姜子牙扯不出什么长篇大论就是想看而已
只为自己活,口碑生效后的修改我和我的家乡亿首日亿姜子牙亿首日亿我就问问编剧干什么吃的口碑崩了吧其他不变号晚修改希望姜子牙口碑对得起我的期望姜子牙亿首日亿我和我的家乡亿首日亿夺冠亿首日亿急先锋亿首日亿一点就到家亿首日亿木兰横空出世亿首日亿号第一次修改姜子牙亿首日亿我和我的家乡亿首日亿急先锋亿首日亿夺冠亿首日亿已出一点就到家亿首日亿木兰横空出世亿首日亿放卫星姜子牙亿我和我的家乡亿夺冠亿急先锋亿木兰横空出世亿一点就到家亿
天真天真tx,这是什么意思大半夜的都是鬼吗
