author,content
Alicey,哥们你这条路选的不对不是反对你去农村开个猫舍而是你的观念有很大的问题你以为开猫舍只需要帮他们不停的繁殖我告诉你你开的这不叫猫舍叫黑心后院从来只把猫当作物品售卖的多半养不好猫你看到有人卖猫赚了钱你也想跟风赚一笔这叫驱利所以你想开猫舍不是因为你喜欢猫而是因为驱利那和你现在的处境有什么不同以前做的工作也是不喜欢的吧再看看你说的这个为什么我看中养猫猫吃得少猫不易得病猫繁殖快猫不易死猫投资少我看过之后下巴都要惊掉了你确定你不是活在梦中是谁告诉你养猫容易的一个个回答你猫吃的东西不在多而在精看似一个很普通的小罐头可比你吃的肉成本高然而你却在这里幻想给它们吃大米饭猫可以不易生病但前提是你要照顾周到你哪来的自信心照顾好猫啊我看你自己都很难维持生活了吧猫繁殖快是因为发情的次数多但发情就能交配吗不是啊猫也要讲你情我愿两个看不顺眼的你硬要塞在一起结果只会是打到你死我活的状态然后你大概不知道一件事正规猫舍的猫出售的都是绝育猫而且一年只繁殖几胎你恐怕连给猫做绝育都不舍得怎么让人信任又怎么会有人去你那消费在你眼里养猫的都是傻子吗不易我真是无力吐槽了你是认为只要喂饱了让它们自生自灭就好了吧想骂人投资问题你认为投资少只是因为你傻很单纯的傻任何创业行为投资都不会少这边建议抛弃不切实际的幻想继续搬砖为好呢
情书Dolls,我在我们当地居委会领了一张房屋永久居住劵免费得到了一套崭新的房子又找了一个专业室内设计师设计这套房子因为我太可爱于是设计师决定免费帮我设计这套猫舍我每天闲的发慌也不好好工作天天坐在房子里看着师傅忙活很快猫舍就装修好了师傅说因为我家猫太可爱了就不收装修的钱了对没错我们一家都是辣么可爱然后买种猫我也没花钱老外们觉得我人挺不错就直接就送我了国际托运方也没有让我掏运费他说大家都是地球人就应该互相帮助多么有爱的地球邻居啊我家猫可能是基因好吧从来不需要吃猫粮和肉那些每天早上起床以后我会把它们的埋在土里晒晒太阳然后再浇浇水晚上再把它们抱到屋里来每到秋天他们的附近长出新的小猫咪苗苗一个赛过一个可爱我只要把新生的小猫咪苗苗的继续埋在土里来年又是一批好收成狗头绿色有机绿色有机前阵子家里有只小猫生病了带去医院治了一阵子恰好宠物医院的院长是一位土豪阿姨退休开宠物医院是为了体验生活挥挥手就把我将近的医药费全免了想想我真是太幸运了因为我的无公害有机猫咪田种得很好每天想来体验我家天然绿色有机咪的人络绎不绝我的猫咪越卖越好生活也越来越富裕我的午餐一度从一菜一汤变成一菜一汤还加个大鸡腿奢侈如我喜欢吃的好欢螺螺狮粉的我一买就是一箱有时候我还会开上一瓶冰阔落享受装的高质量生活情书布偶猫舍买家秀后来我遇到的客户每个都是一句话不说就劈头盖脸砸我钞票的大傻瓜一不挑剔二不讲价三还不要求售后我从来不需要打广告忙于经营因为根本没有人是我的竞争对手全世界种有机猫田的人只有我一个作为世界第一人成功是必然的我时常会觉得迷茫又孤独这也就是常人所说的高处不胜寒吧这不这会我又开始觉得迷茫了唉现在是凌晨三点多了不知道我这个梦等会在我上完厕所之后还能不能续上目前还不太清楚做这种梦对睡姿有没有什么要求如果我找到了其中的诀窍后续一定会来和大家分享的
here hiro,在农村开猫舍不如开狗舍宠物狗卖不出去还可以做成肉狗宠物猫卖不出去就只能扔垃圾桶让它成为流浪猫了其实猫舍狗舍都很难养下去的我国现今的普遍生活水平尚不足以支撑起这种颇为宽裕的生活方式总理之前说过我国每人的平均月收入不到一千元建议还是从事一些比较适合我国国情的工作这样才能够比较安稳长久
某科学的局座,如同我之前一个回答所说猫的大规模养殖的难度并不高甚至低于很多特种养殖的难度因为猫的常见病都已经有疫苗和诊断方式了且食谱也是已知的关于成本控制方面建议和肉联厂进行合作生猪屠宰或者鸡屠宰的下脚料是顶级的猫的饲料其营养价值远高于干配饲料而且价格低廉到超乎想象防疫方面建议直接联系当地农技站一般可以买到有国家补贴的疫苗常见的就是猫传腹和猫瘟用于生猪养殖的各种防疫措施对于猫同样管用包括栏内消毒废弃物管理病死猫的无害化处理病猫的人道毁灭以及处理都是经过了研究或者有经验可以借鉴的综上所述国内至少有处大型屠宰基地白羽鸡养殖基地生猪养殖基地附近或者临近区域可供选择问题在于猫之所以现在没有大规模养殖最大的问题不是别的而是市场规模不足和猫类似的一种动物用于皮毛的水貂其养殖规模和难度要高于猫但是其出栏数量在规模以上养殖场的话年出栏量就要高于国内所有宠物猫的存量了假如真的有这么一个规模以上的猫养殖场的话最多半年就能把猫的价格压到成本的价格也就是元一只月龄的猫不论品种这个情况必然会导致目前的所有的小型繁殖场的抵制附成本估算母猫人工授精人工费以及无菌材料每次元猫饲料按天算按照猫平均体重以及料肉比计算上种饲料肉的平均价格计算元场地以及人工费用元运输费用元这个成本在规模增长时是下降的不计算税的部分以及死亡成本
张大官人,想必答主是某音看多了吧说个题外话千万不要在各种社交媒体平台学习如何做生意不然让你亏得底儿掉看了你对养猫的理解推荐你去养猪或者养鸡为什么呢因为你不是很理解猫狗和家禽肉畜的区别伴侣宠物性格光亮的毛发和身体结构健康的身体能够活的更久等食用动物确保饲料转化比例在检查范围内大量使用药物抗生素来确保肉产量食用动物都活不久就会被宰杀所以滥用抗生素但凡这个世界上的事情都是有门槛的如果只见贼吃肉不见贼挨揍那最后就会被打的血肉模糊我有个农村的亲戚来我家借住几天后说养猫要比养牛麻烦猫不能滥用抗生素不能像某音上使用一些对猫有肾毒性的药物和激素这样只是解决了眼前的问题建议题主去养鸡鸭猪牛羊毕竟不用为售卖担心
匿名用户,我算是你口中的城市人吧也花了小一万买猫了我只想说你当我是傻子我都愿意花钱买了为什么不找猫舍环境好的去买说不好听的你描述的地方就是后院要环境没环境要健康没健康你那一次出来那么多猫你能保证猫都亲人不抓人不咬人别跟我说你养养就亲人了我选择买就是为了保证它性格好粘人才买的买回来一个抓人咬人的我何必呢楼下流浪猫又不要钱和你卖的还一样不香么说句不好听的我买猫看那么多猫舍图什么贪便宜我找猫舍干嘛我要的是买回来这个猫是健康的亲人的不是天没不是小疯子
白星人,我只能说奉劝你善良以你的这种观念养育就不说赔钱了基本猫咪就没几个能成功存活下来首先养宠圈一向推崇以领养代替购买让更多的人选择领养猫咪因此购买的猫咪绝大多数都是品种猫对比我国优秀的中华田园猫品种猫在卫生条件和饮食营养不达标的情况下得病率和死亡率很高因此你所认为得猫不易得病和不易死是不存在的其次猫咪虽然吃的少但肠胃弱需要吃的好尤其以高动物蛋白饮食为主还需添加和牛磺酸等必备的营养元素而且作为怀孕的猫咪所需要的营养远大于成年猫咪的需求所以猫咪虽然吃的少但必须吃的好还有正规猫舍对繁育猫周期的要求是三年胎生殖小猫对母猫的身体伤害极大虽然猫咪繁育周期是个月但一年胎就足够让母猫的身体机能消耗殆尽黑心猫舍通过母猫的繁殖不断繁殖小猫赚钱最后只会得到奄奄一息的母猫和一群先天不足的小猫最后再说你所言的投资少拥有繁育权的品种猫价格都是以万来计算的并且要进行基因测序确定公猫母猫没有遗传疾病如果你只是通过你所看到的元的猫所繁育并且胡乱配种你所培育的小猫是卖不出价格的最终只会害人害猫综上所述你赚钱可以但如果想通过你这种思维养猫赚钱请出门左转好走不送
九方空,之前去过一家猫咖感觉他家的经营模式挺好赚钱角度上明面上是一个猫咖然后还做猫舍还做宠物用品上美团点评做推广客人发朋友圈也能做推广来的客人加微信自己朋友圈打广告精准定位喜欢猫的人士是否有微博不太清楚开店位置在一个大学附近出校门步行十几分钟就能到还是老牌商圈附近的居民楼客人中大学生居多毕业找工作以后如果想养猫他家势必是一个不错的选择各项业务之间相互都有提携推广的功效
小黄昏,虽然我不是开猫舍的但因为自己养猫自己有两只猫是从猫舍买的所以对这方面还有点了解你可以参考下首先你准备养品种猫而品种猫就跟你提到的几个想选择猫的理由是完全不符合的品种猫很娇气这不能吃那不能吃动不动生病一次生病的钱可能就是一只猫的价格举例来说我家的美短公猫之前尿闭这已经不算是大毛病了但去医院几天花了三千多一针进口止痛针就是多一天一针而我当初买它也就花了多其次这么多猫舍你怎么脱颖而出无非你的猫血统好品相好价格公道还要会宣传血统好意味着你得花大价钱去买种公种母一只可能就好几万品相好意味着你还要舍得喂养上的投入好的猫粮罐头甚至生骨肉喂养断不可能是劣质猫粮可以糊弄的这些开销也不小至于宣传现在这种自媒体时代或许钱投入不用很多但绝对要花很多精力你要拍猫的美照甚至可能要请专业人士来拍你要剪辑各种视频放在各个平台上第三养猫还得有专业的知识什么猫和什么猫配种能生出什么样的猫你得去学习然而就算你懂了生物的遗传也不是完全可控的可能生出不好看的猫这些猫卖不出去又怎么办你可能会说我便宜出但实际上既然会花钱买肯定是冲着好看去的而便宜的猫很多人可以选择领养的反而市场不大所以说办个猫舍绝对不是你想象中养田园猫那么简单的事情尤其从你的描述中可以看出你对这块的认识其实很少真的诚心想劝一句吃不穷穿不穷随便创业才会穷猫舍养的毕竟是一条条活生生的生命还是三思再三思
仰首拜三清,你考虑的少了你这个就是后院猫舍呗甚至都算不上首先你卖什么猫田园猫闲鱼上一百来块钱甚至免费都能领一只回来为啥要去你那买品种猫这些猫的肠胃极其脆弱你喂稍微差一点的猫粮都可能导致猫没有精神甚至呕吐拉稀再说打疫苗的问题如果没有打好疫苗猫瘟扩散传播你随时血本无归你让猫跑去乱玩感染了猫藓又是大规模传染你血本无归干好自己的专业不要轻易涉足你不懂的领域不然猫受罪你也跟着血本无归
慕容垂,以养殖场的模式来养猫光你这理念就错了猪肉和鸡肉是刚需人要吃的而猫肉谁吃猫是宠物可以说分品相分噱头这个噱头也就是营销你这噱头搞得好一只上万是没有问题的如果你只繁殖然后几百一只得卖你不止赚不到钱还会被所有养猫的骂成黑心养殖场而遭到抵制你只能将你的猫卖给猫贩子几百一只你基本失去不断改良品种的可能生出来的就只能叫猫了基本只能卖给第一次养猫的人但凡有点养猫知识的人都不会接受你家的猫所以想办养殖场可以看看猪鸡啥的宠物真的不能用养殖场的方法繁殖
abcdefg,主要是你这个模式很微妙你要是卖给个人的话人家是肯定要上门看猫的农村地理位置偏僻的话大部分人都不想去就放弃了直接卖不掉吧你要是卖给宠物店的话可能会很简单但是对方压价很容易把自己搞亏本的而且今年疫情我家这边高端猫舍还好销量都不错低端猫舍的蓝猫崽直接泛滥卖不出去啊宠物店都只卖块收你的猫的时候你觉得你还能赚多少呢不过你要是在城里有房子的话可以在农村养大猫产仔然后崽子长大了带去城里代售价格健康品质的话估计还是有希望的
匿名用户,我想去朝鲜开个阿里巴巴我想成为马爸爸第二我今年岁自己做的专业不喜欢真的心力交瘁疫情裸辞了找不到工作了我想去朝鲜开阿里巴巴卖给朝鲜人到杭州取取经先搞一个网站网站再自动更新很快就变成庞大的商业帝国为什么我要在朝鲜搞阿里巴巴朝鲜人多有市场朝鲜封闭有需求朝鲜极度缺少各种没有淘宝支付宝盒马鲜生钉钉朝鲜目前淘宝事业完全空白完全有潜力搞阿里巴巴无门槛马爸爸也是普通本科我也是我看人家马云一年挣几个亿我挣个几万总可以请大家支招详细支招找合伙人也可以提供现成的朝鲜网站也行迫不及待了等我成为了马爸爸第二我给各位发朝鲜版淘宝的满减的优惠券
catletter07,作为一个猫舍实在不建议猫咪繁育周期长你四十多岁上有老下有小你能挺住一年两年的持续亏损吗你的种猫怎么引进好的种猫谁给你差的种猫要么一身病要么没有母性要么一胎一两只这些坑你知道吗另外你想做什么品种然后各品种品相价格这些你有了解吗我们家猫咪一年生一窝半两年三窝但是按你的想法肯定是一年三窝的这么高频率的繁殖母猫如何照顾奶猫如何照顾品种猫不像田园猫接生不及时照顾不得当很容易夭折或是一身病铺货问题你猫比别人便宜几百你自己吃什么以目前市场低价东北猫为例宠物店进货很多都是直接找到那边猫舍对接但这样的猫舍都很稀少一般靠谱点的都有固定合作的伙伴有一定保障更多的是如你一样的养户被代理集中贩卖四五十天出窝回家星期猫这种都是骗骗小白散户你如果大规模繁殖肯定不是卖散户的你在农村如果不在东北那样产业链十分成熟可以飞各地那只能瞄准本省的市场现在宠物店不是以前了大多数还是爱惜羽毛的毕竟网络这么发达星期猫卖几次很容易在网上曝光了所以一般也是选择靠谱的伙伴或者去收家猫崽子至少比你的安全些而且现在年轻人买猫价格是一方面健康考虑更多自夸一波我们家猫价格跟宠物店差不多或者低一点但是我家猫一般出生比较快就能预定掉因为有保障签协议猫瘟十天腹水两个月打针驱虫每周拍视频给家长所以活体价格是一部分品相跟健康更重要说难听点你入行早几年打价格战完全没问题但现在价格战真的损人不利己猫咪繁育真没那么简单想做好难大规模做更难我只是一个家庭猫舍猫咪精心饲养进口粮生骨肉仍然经常遇见大大小小的问题你做大规模问题只会更多最简单一条传染病防治就够你受的引进猫咪的时候有一只带猫瘟的你整个厂都完蛋当然如果你是专业化请兽医和各种专业人士进行专业华养殖那就是另一回事了可你这样做成本又上来了最后欢迎各位养猫的小伙伴一起交流泉州的小伙伴也欢迎过来撸猫呀
家有萌猫,可行啊现在养猫的人很多市场很大做好了比上班强百倍但是要想开好猫舍也没那么容易你需要掌握很多很多知识最基本的猫咪品种猫咪习性还有医疗常识等等我这边有很多库存资料可以分享给你无套路纯给哈这年头当好人不易啊
我变成了一条狗,首先猫的价格从来就不是看这个猫咋样而是附加值和营销来决定它的价格滴所以你这样做行不通除非你有话语权为什么现在有些铁憨憨开口闭口指责你不喂进口粮为什么有些铁憨憨开口闭口骂人虐猫为什么有些铁憨憨总是拿血统说话为什么有些铁憨憨总是操那么多心除了蠢的坏的站着说话不腰疼的就只剩下商家在营销可悲的是一些铁憨憨自己上套了回头还要拉个垫背的只要养过猫的就知道它多能生两只猫配个对几年时间可以给你整出几十只上百只这种呈指数性增长的东西要想维持价格就只能靠所谓的品种品相血统来巩固立一手审美固一手血统开局一个品相谁钱多谁说了算什么时候崩盘就得看庄家什么时候跑早几年的蓝猫现在的布偶都一样的眼看价格要崩了一些商家就急眼了甚至一些商家一边从猫厂拿货一边破口大骂猫厂没道德心就像核桃啊藏獒啊等等之类的其实猫也是一样的可悲的是对生命毫无敬畏之心拿着当谋利的工具还美名其曰爱和善指责别人虐猫的同时却忘记了自己就是最大的虐猫同伙为了利益为了可以继续后续的消费制造出了各种身体缺陷的猫说来着实可笑这样的人居然还可以嘲讽普通的养猫人我是狗子希望你幸福至于我为什么跟你扯这么多因为你的猫值钱与否能卖高价与否完全在于你的话语权就这么简单你没得话语权同样的猫别人可以卖你只能卖几百你卖起来了人家随便几句话有意无意的指责给你挂个名头什么星期猫了什么后院猫了什么血统不纯了再搞几个极端例子你还想卖猫你卖个卵子
云森家的喵,我是在城市里开猫舍的农村人我也想回农村开老家的房子又大又不用房租不比城市里轻松但是行不通首先医疗条件就不行老家那种小县城的宠物医院医生水平怕是还没我好仪器估计也不咋滴然后是客户群我的客户中同城的占了很大比例大城市买猫的人多小县城的人即使买猫也大多只买一两千的不属于我的目标客户群最后也是我最害怕的怕那些个鬼亲戚家的孩子趁我不在家祸祸我家的猫至于题主说的其他点猫吃的少相比于中等体型狗猫的确吃得少但是猫粮比狗粮贵中端进口粮一斤能吃的国产粮也得一斤因为猫是食肉动物如果为了省成本喂劣质粮省下的钱绝对在医院翻好几倍地花掉除了猫粮我还得三天两头喂罐头各种肉类鸡肉牛肉鸭肉三文鱼等等吃得比你少但吃得绝对比你好猫不易得病猫太容易得病了好吧动不动应激给你看轻的拉肚子呕吐重的传腹现在传腹药便宜多了但几年前传腹没个十几万根本下不来花了钱也不一定能治好另外猫的一些常见疾病题主了解吗知道该怎么治疗吗还是说准备生病了就让它自生自灭还是一有问题就送医院首先猫瘟猫癣等是最基本的吧还有毛囊炎结膜炎角膜炎角膜腐骨膀胱炎肠胃炎结石鼻支杯状衣原体等等数不过来这些在做猫舍的过程中都有可能遇到合格的繁育人都等于半个医生不会治疗不会打针喂药可别做了猫繁殖快猫妊娠期天左右哺乳期天加起来个月了就算中间不间断地生一年也最多三胎但是不停地生你忍心吗中间总得给母猫养身体休息的时间吧我家母猫一年一到两胎主要看母猫身体状态及发情状态有的母猫生完一胎大半年都不发情只能等着当然有的人会选择打激素强制发情我绝对不会打对母猫伤害比较大不发就不发呗正好它休息我也能喘口气不过我听过很多后院在小猫满月就强制断奶母猫继续配继续生如果是想这样还是别做了祸祸猫猫不易死太容易死了特别是品种猫大猫先不谈好好养的前提下死亡率没那么高这里说下小猫我是繁育异国短毛猫的在我刚做的那会儿每一窝的成活率只有百分之五十这还是我接生的前提下我要是不在可能只能活一只甚至一只都活不了新生小猫极易死亡对温度湿度环境的要求很严苛拉个肚子都能死母猫压着也能死爬到窝外面也能冻死在小猫两周龄前我每天基本只能睡三四个小时奥对了做猫舍不仅要有丰富的知识体力也得好准备好经常熬夜吧身体不好的人别做猫舍猫投资少投资可不少首先是买种猫的钱我一只种猫就得好几万所有种猫加起来多少万就算你做低端一只也得几千吧只也得上十万另外种猫也不是买来就能生的得等它长大这过程又是一年半载中间产生的饲养成本算过吗每只猫每月就按的最低标准只一年这还只是饲养费医疗费算过吗大病准备好吧小病各种药一年也得千把块另外我还有房租水电一年左右大小猫的驱虫小猫的疫苗奶粉算进去没有前期投入的猫笼爬架等等算进去没有猫用品算进去没有一瓶沐浴露两百多一套就得上千梳子三百多一把泪痕产品每月得两套还有很多杂七杂八零碎的就不一一说这导致我至今不敢算账算下来真的回不来本要不是因为热爱我肯定不做猫舍累死累活还赚不了钱但是每天再苦再累看到一群小可爱们真的是心甘情愿地伺候它们退役绝育掉的种猫我也舍不得找领养怕别人对它不好害心太软也不适合做猫舍净是赔
茉莉宝宝的麻麻,请不要伤害猫谢谢
试图成为铲屎官,你就是想迅速挣钱暴富而已按你想的除非干点丧良心的事基本很难在几年内发起来首先光种猫的引进你就想简单了你光看见别人一只猫卖没看见人家种猫引进的价格就远高宠物级市场价一只美短种猫都能几万再说养猫的成本我去的那家猫舍一只猫一个月就要吃块的猫粮一百多的罐头还有维生素等猫的营养品这还只是幼猫对于繁育猫成本只会更高还有你会做猫饭吗会给猫打疫苗吗会给猫治疗常见的小毛病吗会给猫接生吗然后你有固定的消费群体吗你有为客户终生提供帮助的能力吗你有应对风险的能力吗猫这种动物养一只还好养养一群非常不好养如果一只猫不慎猫瘟猫鼻支你一窝猫就基本凉凉当然了如果你本身就是想卖星期猫的话当我什么也没回答或者你非常有钱亏个四五十万也无所谓那我非常有幸和你用同一个
克拉福赫萝,想多了猫相当不好养或者说什么动物养到专业繁殖阶段都不好养那么多品种你搞得清楚吗什么品相在什么品种中是优秀的表现什么是不好的表现你玩的明白吗养宠物养到最后都是基因遗传学家你有信心像孟德尔种豌豆一样一代一代的搞吗还猫不容易生病猫舍养的可不是一只两只的小猫一堆猫在一起得了猫藓怎么治得了猫瘟传腹怎么治长眼屎灰下巴怎么搞打架破相了怎处理猫猫狗狗的生病多了去了一切的一切都解决了还有一个大问题摆在你面前就是你到底喜不喜欢猫如果你是因为爱猫想去做猫舍那你能接受一胎生出来死几只小猫的现实吗你下得去手淘汰那些不好的猫吗养一只猫可以不计成本的去爱他我妈妈养的小土猫花了好几万看病买玩具了她愿意但是猫舍是生意一只最多卖的猫得了需要就能治好的能治的病你治不治呵呵如果你不爱猫单纯为了生意那我觉得真的没必要搞猫舍啊你贸然踏足一个未知领域不就摆明了想赔钱吗总之你现在这个状态属于啥也不懂就要在空白领域干大事的我建议你看看罗永浩老师他当初想做锤子手机的时候也是觉得手机领域很挣钱他上他也行事实证明雷军库克余大嘴他们上行挣钱他罗永浩真不行这不现在还没还完钱呢
哈哈哈哈哈哈哈,你真的了吗
番茄炒蛋有点甜,你是从哪里得知猫不易得病的一般不得病一得病发现不及时殃及池鱼而且从题主这语气中了解你想赚快钱抢银行吧钱来的快别开猫舍了哪有那么多快钱可以赚还繁殖快呵呵你自己先养只猫再说开猫舍后院猫吧
种花家的猫,不可行出于你会提出这么傻的问题第一你不懂猫第二你只是听别人说猫不容易得病你没见过繁育人的猫一窝一窝死的时候第三你光想着低价出猫没有考虑过母猫是否会带猫是否会难产母猫都不能够给你生产小猫你的小猫又从哪里来第四额外开销猫砂猫粮基本营养品在考虑每只猫猫都要保证的健康的情况下耳螨先不说耳螨这个东西猫一多没有多余的笼子隔离治疗是很难全部治愈的猫藓治疗周期长花费时间精力大也需要隔离猫疱疹各种药物滴眼液口服消炎注射消炎等等等如果你要干我就去你旁边开个宠物医院应该挺赚钱的第五你这种思想想把猫卖客户基本上是没人买的基本上都是收猫的收而且你不知道怎么用后院的条件卖出干净好看的猫仔不是你一个人在繁育猫收猫的也不是傻子也有也有择优标准每次从你这打包只回去到家死只谁又敢在你这里拿猫第六如果你有钱拉人过来帮你繁育猫那当我没说反之你先自己亏个两年再去想想自己怎么盈利
子南,劝你善良
