author,content
秋风雪影,英雄联盟全球总决赛
匿名用户,不好意思这就是知乎的分析水平别的不说这么多说夺冠会第一的动辄几十亿的能认认真真先看看每日票房尊重下数学规律吗没有说夺冠不好的意思微笑脸个人预测总票房我的家乡亿级以上姜子牙亿急先锋七八亿夺冠五六亿具体票房不肯定但这个排名姐百分百确定电影全部看过了排名和我个人喜好无关去年被称为史上最强国庆档祖国机长攀登者分别排名影史排名总榜回顾下有些许参考意义我和我的祖国总亿攀登者总亿中国机长总亿以及创下国漫记录的哪吒之魔童降世十日内票房数据最终票房亿
邱小明,月日新闻我和我的家乡逆袭姜子牙夺得年国庆档票房冠军
一方通行,谁票房高我不知道但我知道如果解封大学这些电影的票房能翻倍
apple,姜子牙理由是不喜欢捞钱电影现在的电影大部分投资都给了演员可很多演员演技还不如动画片呢
匿名用户,我已经看了夺冠今天准备去看姜子牙和我和我的家乡先说下现在的感觉个人感觉夺冠或姜子牙姜子牙吹的太高营销做的相当好我个人感觉哪吒还没风雨咒出彩个人感觉别揍最后哪吒的热度炒到了一个什么样的高度大家有目共睹姜子牙还没出售已经卖脱销只要姜子牙保持一个及格线水准他的票房就会高居不下即使大鱼海棠这烂片当初也是票房第一大家一副不信邪的样子非要去看能难看到哪里去夺冠老少皆宜皆宜到什么程度皆宜到我多岁的外婆多岁岁的老妈和岁的我坐在一起看都可以哭成二逼我个人是因为家里人喜欢看比赛女孩里约奥运会那几场我全看了前期小组赛真的气得砸桌子后面赢巴西那场哭成傻逼我妈爸还看了好几遍重播女排精神是一个时代的印记可能一部分年轻人不在乎运动所以不会看但是它那部分缺失票房可以被老一辈撑起来
陈水墨,票房第一姜子牙有大圣归来哪吒口碑加持虽然和大圣关系不大姜子牙水准上应该不会差唯一需要担心的是故事情节能不能撑得起来从预售和关注度方面来看这部片热度也相当高只要自己不掉链子基本没问题另外看好姜子牙得第一的原因是因为另外几部片很难达到口碑爆棚的地步反向衬托了姜票房第二我和我的家乡国庆主旋律片也是继承了去年的我和我的祖国虽然几乎不可能达到去年底高度但有国庆大背景很多不想看类型片的观众和合家欢的观众都会把家乡作为首选有广泛的群众基础表现也差不了只是这种由多个故事拼接而成的电影看起来实在是不够爽甚至不知道能不能称之为电影除非每个小故事非常精彩且彼此之间连接巧妙否则想凭借故事性达到口碑爆棚基本不可能票房第三急先锋可以说是标准的贺岁片同时有巨星压阵有流量偶像出演又是很爽的动作片选择的人也不会少票房第四夺冠虽然十一前票房处于领先状态但目前来看口碑两极分化大家对女排精神毫无疑问是认可的但对于整体故事性并不太认可否则现在应该已经口碑爆棚了另外女排这个虽然人人皆知但毕竟相对来说影响范围比较局限于体育领域很难进入到大众的前几个选择票房第五一点就到家由于上映时间较晚基本上是输在了起跑线上也许宣发方是想着大家把电影都看的差不多了没啥看的了再后发制人这样的策略本身没问题只是不知道到时整个市场是个什么情况目前来看该片总体关注度较低没有前四部的巨大优势只能靠自己口碑发酵成败难料
观澜阁阁主,盲猜一波我和我的家乡亿亿姜子牙高开低走亿
答案在牛奶箱里,大概看了下评论我已经一部都不想看了说实话中国的电影问题还是很大基本要一年甚至几年才能出一部好看的剧随着看过的电影越来越多口味也越刁钻了如果不是很好的电影我真的难有动力去电影院看它
三岁半的Cynthia,高四党二分之一的假期休整时间献给了姜子牙和我和我的家乡看姜子牙的时候看了次手机回了两条消息看我和我的家乡的时候没看手机所以我赌票房第一是我和我的家乡好像我一年中的大部分眼泪都献给了喜剧片
爱电影的郑同学,必须是我和我的故乡今天看完太好笑太好哭了很久没有感受过一群人一起笑的瞬间我和我的故乡真把全场观众都给笑傻了相比姜子牙最大的笑点是结束彩蛋哪吒出场的那一刻其他电影还没看虽然评价一部电影的好坏不能简单用好不好笑来形容但作为一个观众就不想管那么多啦它让我开心我就喜欢它就觉得它好仅代表个人观点保命也很久没有看到电影院这么多人不知道为什么好感动
三月流苏,我和我的家乡后发制人国庆档票房冠军预定姜子牙口碑应该不咋好前期爆发后期乏力夺冠中规中矩而且已经掉队了另外两部不在一个体量
Cherie,不好意思来蹭个热度推荐秀美人生这是一部非常好看的电影听这名字分再翻翻电影简介政治电影分我完全理解这种心情但是请相信我这是一部非常好笑的电影你买票进去不笑十次输而且这部政治电影完全不同于以往那种人物形象片面的政治电影这是一部有血有肉的电影每个人物有性格有故事这是一部有广西特色的电影取景在广西风景秀丽镜头美背景音乐是壮族的山歌经过处理与故事情节相辅相成完全不会觉得突兀人物的穿着打扮口音都非常广西是我在电影院看到最亲切的电影广西人千万别错过国庆给我去贡献票房最后向黄文秀及所有奋战在一线的脱贫攻坚战战士致敬祝福祖国明天更美好国庆节快乐
花萼哩蛤,出不去校门
忱三水,一点没感觉姜子牙是个适合小孩子观看的电影这片子各方面已经很出彩了虽然也有瑕疵的地方但说是国漫顶尖水平并无不可最后师傅的师傅和渡劫城莫名有些心酸那种坐困孤城的无力感很让人揪心这样的结局说是主旋律真的有些埋汰人了就目前剧情看姜子牙绝不是一部可以大卖的电影对手拉胯另算
张维卿,目测这几部片子质量都不是太高所以我猜明星最多的那个票房最高
边走边唱,用行动说话我只买了姜子牙电影票
唯物不违心,急先锋烂片其他没看但是就看看龙叔吧
桃花换袋小鱼干,这几部电影目测没有一部豆瓣会上分矮子里面拔高个我猜是我和我的家乡是冠军
沟沟壑Cindy,夺冠看了平平无奇只能说剩下的还没看估计是姜子牙毕竟有哪吒在前面给铺路了修改一下姜子牙口碑崩了不去看了
黑艺之术,除了姜子牙其他剧情结局我都能猜个大概夺冠无非就是历经千难万险为祖国夺冠了心血澎湃一阵或许连心血澎湃都没有我可能全程没有表情一样看完结局肯定是喜悦的我和我的家乡一听就知道写家乡人情风土怎么怎么样然后我受家乡影响外出了回来发现还是家乡好可能中间经历点什么生离死别爱情辛酸然后回来建设家乡其他的基本都是好结局过程中死点人然后强行大圆满中间毫无笑点应该是可以说国庆节上映的基本没有一个结局敢写黑暗的所以盲猜姜子牙
匿名用户,我都想看啊但是封校出不去啊啊啊
present,对于电影投资来说最稳的就是这类题材电影
[已重置],我和我的家乡
娱乐资本论,国庆档硝烟已经弥漫在眼前可以预见这个档期票房厮杀的激烈程度今年国庆档有三部春节档影片夺冠急先锋姜子牙再定档又有献礼片我和我的家乡以下简称家乡一点就到家坐镇以及借势话题片木兰横空出世的加入涵盖了多种影片类型虽然内容看似强大但今年国庆档也尤其仓促相比较过去影片提前个月定档的状况今年多数影片都是临近国庆才定档这也让影片的宣传周期被缩短前期造势不足各影片的定档方针也出现了较大改变急先锋抢先一天定在最晚的再见吧少年在号才上映预售情况也不理想截止发稿前国庆档首日预售票房亿去年同期为亿而十一几天预售总票房才超亿预售情况不及预期说明今年的影片票房走势极度依赖内容质量和口碑年与年国庆档首日预售票房对比这里暴露出来的问题则是营销缺席电影市场经历过大半年的打击在营销费用上的投入可以说是能省则省宣传物料的铺设情况也不如去年大阵仗今年国庆档想要超越去年亿总票房成绩还需要打个问号预售票房不敌去年一半最强国庆档前路不明去年国庆档总票房超过亿两部亿量级一部亿量级今年还能有如此繁荣的景象吗今年各大影片对偷票房一再慎重夺冠和姜子牙都采取了密钥采用分时段发放的方式对于这些在春节档投入过多又因疫情遭受损失的影片而言国庆档的成绩确实有关到背后出品公司的业绩据娱乐资本论矩阵号营销娱子酱统计包括夺冠在内的部国庆影片背后出品含联合出品公司已达家远超去年的近家其中我和我的家乡背后的资方关系最为复杂出品以及联合出品公司近家国庆档影片中最先上映的夺冠用女排精神指代民族精神渲染情绪但就目前口碑看来观众未达成统一意见而其他几部影片中家乡群星喜剧的特点使其具有很强的辨识度急先锋有着动作冒险的爽感姜子牙是具备高认知度的神话故事一点就到家青春励志的类型则在年轻人中颇受到青睐但尽管影片各具特色今年国庆档的预售票房并不如想象中热闹根据猫眼数据显示目前十一首日的预售票房仅有亿而去年十一首日的预售票房仅仅是我和我的祖国攀登者中国机长这三部大片就已经接近亿今年国庆档首日的预售成绩甚至不到去年的二分之一这是因为今年国庆档多部影片的定档十分仓促也就导致了预售战线缩短最长也就是十天左右并且多部影片定档之后又更改了上线时间夺冠提前上映打乱了预售计划另一方面疫情原因让三部大片延迟到了国庆档上映但观众已经提前接受了影片的宣发内容长达大半年的时间对观众来说其实会导致期待减弱在此之外今年国庆档预售票房不敌去年还有一个重要原因那就是去年是建国周年特殊的时间节点和三部主旋律大片带来了强观影情绪让观众十一进电影院这件事具备了仪式感使得预售票房暴涨而今年无论是经典神话还是扶贫题材都不太能让观众产生统一强烈的观影情绪也使得预售票房不如预期艾维数据调查后发现今年国庆期间明确表示看一部电影的人数约占有观影意愿人数的看两部人数约占看三部集以上的人数占而不确定看几次电影的人数占比达到了数据其实是一种佐证今年国庆档观众的观望情绪较重大概率会根据影片的质量和口碑决定之后观影计划但话说回来观众之所以对国庆档影片的期望值不高也和影片因为仓促定档导致的宣发周期压缩脱不开关系被压缩的宣发周期姜子牙预售领跑家乡料足势猛月日就宣布定档的家乡率先拉开了国庆档的序幕但在月日两部原春节档电影夺冠和姜子牙同时宣布定档才让这个国庆档的票房竞争变得有意思起来家乡明显有备而来截至目前其一共发布了支物料预告海报和是国庆档影片中物料发布数量最多的从月初开始家乡就以每周个物料的节奏带动想看指数的增长尤其是月日发布的首支预告天上掉下个在抖音上播放破亿致使想看指数激增达到一个峰值临近上映的前两周每周放出物料开始增至个物料弹药充足明显延长了影片造势的周期在这过程中家乡逐步告知了影片的明星阵容和主创团队弥补了认知度不足的问题反观有先天关注度优势夺冠和姜子牙在新物料的制作和发布上却没有那么积极许是家乡势头太猛夺冠率先在发行上做出突破试图先发制人在月日宣布提档至号还在当天开启了预售这一步为口碑管理争取到了时间在空档期抢得更多票房有趣的是姜子牙反而很沉得住气日国庆档统一开启预售姜子牙放出了一支成团出道的与哪吒大圣敖丙做绑定灯塔数据显示首日预售超万居然成为第一名领跑之后姜子牙的物料跟上了节奏上周日还发布了一支终极预告也带动想看指数上万的涨动目前其预售总票房已破万超越造足了两个月势头的家乡姗姗来迟的急先锋在月份才决定加入国庆大战另一部名不见经传的一点就到家在月日决定改档至月日才上映观察这两者想看受众的用户画像宣发策略的变动或许是想打出差异化优势因动作片属性急先锋的男性受众几乎占到一半以上是国庆档影片中的唯一个例具有较明确的性别营销指向性因而其预售票房走势也趋好向万靠拢一点就到家则是相反的情况其女性用户占比出奇地高竟超过岁以上受众占比则偏低表明该片的年轻化走向较为明显可以主打她消费此外直接避开前期大片票房竞争也是个聪明的选择只不过目前热度和预售票房走势还不够明朗在这个特殊的国庆档期中预售开启较晚能激发购票转化的宣传举措较为被动只能转而抓紧线下点映路演铺开口碑同时还要在尽可能多的渠道传播影片内容吸引观众兴趣国庆档营销寻求性价比最小支出换最大收入钱都在春节档花完了一位营销从业者发出感叹虽然国庆档有三部春节档大片上映但在营销动作上却显得十分低调某种程度上来说这三部影片还在依靠春节档宣发动作的剩余影响力吸引观众走进影院而其他几部影片受到电影市场的影响都希望寻找最具性价比的营销方式此时直播作为在今年强势崛起的渠道兼具话题制造和销售能力被影院以及影片方重视起来其实此前直播卖票就取得了不错的销售成绩大鹏携电影受益人进入威亚直播间时万张电影票优惠券在秒内售空不过国庆档影片直播售票的动作不是销售单部影片而是为整体电影院线带票徐峥则成为了最重要的参与者八月中旬徐峥一天之内参与了两场电影频道发起的直播带票活动一场在抖音徐峥邀请了张一白陈赫谭卓王俊凯助阵销售包括一分钱看电影在内的四项权益最终直播间累计曝光量超亿发放了万的福利带动部影片售票而另一场在京东的直播带票活动中徐峥先是售出了张优惠券和兑换码又赠送了张抵扣票通过各种补贴来激发用户的观影热情高晓松带着一点就到家做客李好聚划算冲击播特别栏目时也在销售一点就到家影票之外为电影通兑劵吆喝在电影行业含有自救意味的直播带票外短视频营销成为国庆档各大影片较为主流的营销方式家乡是典型的将预算大头投放在短视频上的例子据娱乐资本论观察家乡五个故事预告片在抖音先后释出第一个外星人单元就依靠黄渤的独特口音将带成了抖音热词其后每个预告片都会使电影在抖音上的热度持续升温除了预告片传播家乡还与抖音官方开战了合作在站内上线我和我的家乡在抖音主题活动这一连串营销动作使家乡在八佰霸占抖音院线电影营销榜期间始终占据第二名的位置远超其他国庆档影片相比较家乡的大手笔一点就到家显得十分节省目前在抖音及社交平台传播的短视频以两类为主一类是刘昊然等主演的影片造型花絮等物料另一类就是将刚刚结束的电影路演片段截取作梗目前在抖音传播较广的彭昱畅叫错疯产姐妹刘昊然被男粉叫宝贝等话题都是在路演中产生的在国庆档影片中目前只有姜子牙依然走在话题制造的路子上延续春节档时和西游记之大圣归来哪吒之魔童降世联动的路子不过现在来看姜子牙和这两部国漫之光的捆绑营销比春节档更加紧密不仅让哪吒敖丙大圣和姜子牙组成神仙天团还发布了快乐似神仙的出道试图将自身和这两部片子拉到同一水平线上对这三部电影的出品方光线来说捆绑营销确实是省钱省力的营销方式很快就拉高了电影的认知度和观众的期待值但同时也可能遭受观众预期管理不当的反噬结局需要慎重对待从国庆档这些影片的营销方式来看各方都在求稳求省没有出现出格的营销动作这也给观众造成了国庆档造势不足的印象不过希望在于观众还是会因为好影片进入影院今年国庆档承载了各方期望需要等待一部足够优质的高口碑影片带热大盘点燃观影情绪释放观众们被积压了大半年的观影欲望
瞎子,矮子里面拔高个
小脑袋瓜子,个人预测姜子牙
ester,今天去看了急先锋是活动免费送的票出发前在支付宝上看了一眼基本上满座了实际到了影厅只有四个人剧情简单也蛮多
李仙姑本姑,姜子牙我买了两张而且场次基本爆满
阿木,暂时只看了我和我的家乡整体观感还是不错的有泪点也有笑点有些演员完全颠覆了以往的形象不管怎么样都是值得称赞的
转益多师,突然有个问题家乡里面最后一课范老师为啥不把颜料整管揣兜里而是要挤到调色盘上
袁先生,其他还没看昨天被朋友拉着看了同期票价最高的急先锋因为朋友有券凭券所有电影一律所以选了个贵的四个字评价如坐针毡的票价都不值
夏夏,家乡
纪永臣,明天去看夺冠预计夺冠的票房会夺冠
番茄你是西红柿,我和我的家乡最起码国庆档我最想看并且已经约好明天去看了
王怜花,夺冠吧无论是主题演员的演技还是整体的格局都是明显碾压其他几部的姜子牙本来是很期待的毕竟片方一直宣传哪咤联动篇要搞一个封神大宇宙但是看了一些大家的影评似乎口碑不是很好就是优点很明显缺点也很明显缺点主要就是故事线不行国产动画片就这样发挥有点不稳定哎之前的大圣归来还有白蛇大护法都是优缺点太明显所以加上现在疫情防控常态化大家看电影还是比较谨慎和冷静的应该不会刷出来太高的票房
哦-我的老伙计,我和我的家乡第一吧不过小县城电影院只有零零散散几个人
允忆,估计是我和我的家乡票房最高上午打开豆瓣的结论本来只想看姜子牙的现在只想看我和我的家乡了
虫二,我和我的家乡哭了三次在我心里就它了
小和尚ai泡妞,刚看完我和我的祖国我姐佟丽娅结婚了后来又离了
马上就睡,感觉会是姜子牙这几个都好想看这几天要泡在影院了
八千里路云和月,没看过的我评价不了急先锋是真的拉胯红海我给的话急先锋勉强分吧看得我满屏都是尴尬猫眼上是怎么打到分的
Ms Pan,我和我的家乡目前想看是因为主旋律主题全员大卡司中生代导演这些因素
trosfans,早上看的我和我的家乡很好看全程泪目刚刚看完姜子牙怎么硕呢感觉故事没讲清不会安利给别人
游走时光的记忆,我和我的家乡
Jing,目前为止夺冠姜子牙我和我的家乡都看了一点就到家也打算看急先锋没兴趣
江阿生,姜子牙在这个比烂的世界我们宿舍只选择了这一部别的更没意思相信有广大大学生同志持相同看法
涤生,姜汁鸭
天边有朵屎做的云,我和我的家乡吧姜子牙虽然来势汹汹只是大家对他的期待已久主要还是归功于哪扎的成功我也第一时间去看了可能期望太高导致特别失望整部电影无高潮套路老强行煽情剧情硬伤我和旁边哥们都看睡觉了总的来说片尾第二个过年的菜单比正片好看虽然看过无数次了第三个彩蛋估计要出完字幕很多人没等就走了由于口碑崩塌估计后劲不足会被超越明天去看我和我的家乡
匿名用户,一点就到家还没上立贴为证一定是我和我的家乡其他全扑半扑多多少少都扑了
刑律小陈,有哪吒做担保第一姜子牙没得跑了
君不见,刚看完我和我的家乡投它一票
番茄炒蛋炒饭,强烈推荐大家去看看我和我的故乡非常催泪几个故事我自己的排序单独的评分我心中分左右评分分左右总体评分分左右
鲁西西,姜子牙
悠悠茶婵,姜子牙会排第一
Bling,刚刚看了我和我的家乡怎么说呢就像去年国庆档一样是几个板块拼在一起的每个导演负责自己的模块确实是爱国电影吧国庆上的电影应该都是这个味道吧不过能把很红很专的电影拍成这样子也很不错了对陈思诚有一点点失望不过还是有他的味道在哈哈哈喜剧悬疑但是爱国这个主题他可能不是特别擅长吧令人比较惊喜的徐峥觉得最后一课这个部分拍得很不错至少我掉下了眼泪哈哈哈然后夸一夸闫妮的演技真的很不错总体看下来一般吧可能前段时间的王牌特工让我觉得更有意思一些更刺激一些但是国庆全家温馨看电影众口难调这种轻松爱国搞笑的电影挺合适的
立以澜,当然是我和我的家乡如果不是的话那么只能我国人民的审美能力有待提高思想深度有待开拓
当年我还是一只猫,不知道我去看了夺冠只能说中规中矩不好不坏是一部合格的献礼片但是说实话第一次在电影院看到这么多老年人基本都是岁以上的七十几岁的好几个可能这就是情怀吧
阿蓝赖,果断来看我和我的家乡
Zak,我和我的家乡第一最后一课神笔马良北京人回乡之路徐峥应该是最强导演无论是年我和我的祖国中的夺冠还是年我和我的家乡中的最后一课都超预期有喜有悲有内涵以小见大剧情好演技好范伟的演技太强了结尾很感人开心麻花团队也很棒五部分中最搞笑的一集完成度也很高葛优的演技没话说经典的葛氏幽默虽然立意没问题但有点偏题整体节奏有点平邓超更适合当演员不适合当导演不过回乡之路也还算中规中矩就剧情稍微有点点全靠黄渤王迅们撑起来的剧情生硬抖音快手这些梗的插入太尬了
蒙喳喳,推荐被埋没的麦路人
木木919,我和我的家乡欢乐急先锋成龙姜子牙超越哪吒是不可能的水准不够一点就到家对新生代演员的期望夺冠平时汤喝多了不来想看这种类型假如我去看这是观影顺序最终票房也差不多会跟我这普通后一样吧我个人心中超越哪吒的国漫只有雾山五行中国神话宇宙如果还只是哪吒的水平那就只能靠编剧来赚票房了
无知不言,姜子牙破动画首日票房纪录前天看了夺冠首先这是一部很好的片子这部片子有前后两部分组成老女排和新新女排在她们身上体现了两代中国人对女排的的寄托改革开放之初全国上下百废待兴人们从物质到思想精神都需要一种改变和突破女排成为最好的寄托
汪牛牛,我和我的家乡姜子牙可能要崩
采姑娘的大猫熊,就这就能看出来大多数影评人水平都有限得很
文哲,看完我和我的家乡内心反而平静了下来一部电影五个故事五个故事都是讲述这国家发展的成果年全面建成小康社会第一个故事关于医保葛大爷还是葛大爷很接地气内容简洁朴素笑点密集第二个故事关于新农村建设黄渤饰演的原型是站主手工耿那个跑步机笑死我了点题相隔一公里的异地恋第三个故事农村教育这个是最有感触的范伟饰演的老范老师年后重返自己昔日的讲台面对沧海桑田茫然四顾自己原来的学生都长大了心目中的城堡实现了这里要吐槽一下李易峰第一眼没认出来第四个故事防沙固土青山绿水就是金山银山邓超饰演的乔树林很是让人感动的角色土里土气却有散发着光芒从农村走出去的青年有多少愿意回家乡搞建设答案是几乎没有太难了第五个故事扶贫沈腾饰演的马亮一个画家在农村这片土地中却有这不一样的感觉艺术来源于生活马亮知道自己想要什么活的明白一部电影的钱相当于看了五部电影今年注定载入史册今年普遍的感受是内心的浮躁和焦虑趁着这个假期好好的放松一下吧
匿名用户,姜子牙就是感动因为太期待了虽然整体逻辑有点但是我就是喜欢我想再看一遍喜欢里面的大场景色也可能因为只看这一部电影导致的
罗的官宣老公,其他不扯我盲猜急先锋最后我现在就正在看真的烂兄弟台词尬的我脚趾抠出三室一厅硬扯感情线硬拉剧情全篇硬爱国没感觉到真正的爱国情感没什么看点睡了再见
杨博士的游记,我和我的家乡因为在知乎的热榜对这部电影评价很高买了北京文化的股票
离梨礼理力,我和我的家乡有笑有泪值得一看
大明湖畔的小明,今天准备买明天的票现在已经开场很久了二维码自动识别
努力努力在努力,刚看了姜子牙说实话没看懂
李亦恩,猫眼票房预测出来按口碑来的话应该比较准了
可笑的孤单,这几部加起来也没有唐探票房高不信试试看
自由散漫,夺冠还不错巩俐确实演的好黄渤和她对手戏被碾压
梁公子吖,我和我的家乡
