author,content
张佳玮,湖人对热第一战上半场两个决定比赛的时间点一是湖人比时换下德怀特霍华德开始坚定打小球对小球戴维斯不在时勒布朗负责协防禁区从此湖人所向无敌二是吉米巴特勒第二节末拼到脚踝伤了热气势大沮前一个时刻改变比赛局势后一个时刻提前终结比赛话说今天开场首发对比明显湖人锋线官方身高公分的勒布朗官方身高公分的德怀特霍华德和戴维斯大球热锋线官方身高公分的吉米巴特勒官方身高公分的克洛德官方身高公分的班阿德巴约小球对位德怀特内线扛阿德巴约戴维斯出来对克洛德防守端热是灵活的无限换防湖人则锁弧顶强投放突破弱侧补位你可以突我后面补但别想着起手投舒服这是针对罗宾逊和德拉季奇的绕掩护投篮即湖人的防守重点是绕掩护强投三分针对的就是希罗罗宾逊和德拉季奇简言之防投但当然有代价你防投那热的突破自然出来突破之后还能分球克洛德吉米巴特勒就分别接突破分球后三分得手最明显的一球阿德巴约一个上线递手假动作忽然转身突破德怀特造了戴维补位犯规湖人的意思我们锁上线三分球你突了我就弱侧补位热的意思你锁上线三分球我们就突你补位我们就分球德拉季奇挡拆阿德巴约乘机得分热一口气比领先打出湖人第一次暂停暂停出来套路没换吉米又持球挡拆挑德怀特得手反过来勒布朗送出一个奥多姆式传球失误球直接挥传出边线了我从没见过勒布朗传这种球很显然湖人的跑位沟通都是乱的之后格林再传球失误德拉季奇远射热比这是湖人本季季后赛第二次首节落后两位数从此湖人变阵德怀特霍华德和勒布朗下去库兹马和朗多上来从此开始到第一节结束湖人一波比是库兹马和朗多比勒布朗和德怀特牛叉不是的德怀特下去后戴维斯回到中锋位湖人用小球阵对小球阵可怕的不只是湖人外围速度上来了而在于戴维斯重回防守中轴了于是热摆脱不出空位连投连丢反过来湖人进攻有空间了内外结合起来了也包括射中了用赛后戴维斯的话说救了我们的几个三分球第一节末勒布朗归来收尾那段极其明显小球阵有空间于是吊传戴维斯罚球勒布朗突破罚球勒布朗助攻戴维斯上篮勒布朗和朗多挡拆朗多突破分球戴维斯卡鲁索三分球当湖人站小球时朗多突破分球都舒服了当然这里也有问题了湖人站小球阵的话戴维斯没法撑全场啊第二节初湖人继续摆小球阵勒布朗和莫里斯站内线问题解决四十年前总决赛第六场魔术师替天勾跳球人都传说魔术师可以打五个位置这话姑且放一边今天勒布朗是真站内线了防守端内线补位进攻端背身硬靠吉米巴特勒喂库兹马远射自己带快攻他当然不是第一次这么打年东部半决赛打步行者波什受伤他就站过内线去对位大卫韦斯特当时他代表的正是迈阿密热当时步行者主帅正是沃格尔沃格尔自己到手了才知道真好用之后吉米一直在努力弱侧接应三分球内线强蹭朗多希罗的两个远射是热本场最后的倔强但湖人的小球阵容让热无从阻挡先是勒布朗助攻格林一个三分那是针对热的防守软肋德拉季奇和罗宾逊再是勒布朗找格林挡拆戴维斯射中三分终于勒布朗送出半场第次助攻给弱侧卡鲁索突破上篮打停了热这里是热最后一点反击机会勒布朗下去了热再变阵调整成夹击戴维斯毕竟伊戈达拉一个人挡不住戴维斯然后莫里斯远射分差分热改站联防湖人上线转移格林度三分球分差分吉米顽强地将分差追到分热这时已经只剩单挑了勒布朗立刻还一个突破得分此时的热体力和气势都在熄灭套路都用了打不过啊到吉米巴特勒突破上半场已得分脚踝崴了比赛到此其实已经结束了半场比的分差期间比的高潮吉米的脚踝伤第三节他退防时还一点一点的到阿德巴约再受伤分差奔分就没啥好说的了比赛的转折点其实就是第一节德怀特霍华德下场湖人用小球阵扣热的小球阵第二节勒布朗站内线带小球阵热冲不垮湖人那其实就没得打了值得一提的是湖人开场的防守初心是成功的邓肯罗宾逊全场投中不只是没投中是直接被控到没啥出手机会希罗有强投得手但终究也就投中克洛德和吉米的弱侧接应三分倒是中了几个但湖人小球阵容封锁突破分球后他俩也没辙了只能硬来加上德拉季奇巴特勒和阿德巴约显然都不是太健康这里真正的关键是湖人两个王牌的全面戴维斯对位阿德巴约时有胆量放空他因为阿德巴约善策应但没射程戴维斯可以全面扫荡禁区反过来热就没法放戴维斯因为他三分线到禁区到处接球都有威胁勒布朗在跟戴维斯同列时负责组织者和弱侧补位独自带小球阵时就到内线去了而且德怀特一下场湖人空间一拉开他的传球就无可阻挡了热的防守脚步很快但勒布朗的眼到手到更快湖人三分球前投中就是空间拉开了球都传舒服了他俩能担负的角色太多了所以湖人有调整余地大球不行打小球甚至勒布朗亲自站内线打小小球都行放小球阵时勒布朗看得见全场的队友戴维斯则在任何地方都有接球威胁热不夹击挡不住夹击了就是空位三分球于是一切都变简单了虽然已经有过九次总决赛三次夺冠的经历但今天应该是勒布朗第二次赢下总决赛开门红之前他九次总决赛只有年一次开门红那个系列赛众所周知最后还输了今天大概也是他历年总决赛生涯打得最写意的一场了戴维斯的分是湖人队史所有总决赛初战的第三高分第一是鲨鱼年的分再是麦肯爷爷的分年季后赛过了火箭和掘金在奥兰多湖人号科比击败德怀特霍华德拿了自己第四个戒指年季后赛过了火箭和掘金在奥兰多湖人号勒布朗带着德怀特霍华德争取拿自己第四个戒指算是巧合吗年和年湖人都赢了总决赛第一场年和年总决赛第一场比赛德怀特霍华德都有点走背字当然那年是郁闷地输了今年他表现一般但赢了勒布朗朗多德怀特那几年我们互相为个总决赛打得天翻地覆如今一起来到这里舒舒服服
苏林深,热火队几乎打出了完美的开局巴特勒中阿德巴约中克劳德中伊戈达拉中三分命中率超过五成领先优势一度达到分左右然而第一节比赛结束湖人却领先了三分原因就在于愈来愈稳定的三分球在月号输给红队的比赛里湖人三分中而在月日输给雷霆的比赛里湖人三分竟然是离谱的中数据统计季后赛至今湖人三分命中率超过的比赛里湖人胜负输掉的三场比赛三分数据分别是中中和中因此很大程度上三分手感大概是一个可以用来表征湖人发挥的重要数据热火拥有一套非常强硬的锋线阵容用这套阵容击败了雄鹿和凯尔特人但他们的联防和包夹却被湖人用超热的三分手感和詹姆斯的超强出球能力化解而面对湖人强硬的内外线防守热火则显得有些措手不及或者说不够适应无论是詹姆斯还是霍华德抑或是拉简隆多丹尼格林都拥有极其深厚的大赛经验而热火主将无论是巴特勒还是德拉季奇抑或是表现亮眼的希罗与阿德巴约都从未有过总决赛经验防守被湖人的三分击碎后内线也开始顾此失彼恍惚之间湖人突然开始主打内线卡鲁索库兹玛与戴维斯连续空切上篮暴扣中场结束时湖人领先优势来到了分詹姆斯轻松打出了一个看起来是在极力串联球队的数据热火之所以能够一路过关斩将走到现在其中一个重要因素是岁的锋线新核阿德巴约他几乎在过去的三轮系列赛里予取予求然而在这一点上湖人的安东尼戴维斯却几乎在所有层面都比他要强一些阿德巴约米臂展机动性强敏捷度高中分篮板戴维斯米臂展更稳的中距离更敏捷的身体更强的力量接近如果说上半场湖人是用三分和出球让热火的防守顾此失彼那么下半场湖人则是用内线优势彻底拿下了比赛显然就本场比赛而言热火拿詹姆斯和戴维斯没什么办法湖人却让热火新贵阿德巴约和泰勒希罗感受到了季后赛至今为止最强劲的防守经验和天赋的差距是巨大的更多的篮板更多的助攻更多的抢断和封盖这支谈不上年轻甚至有些老迈的湖人队在场上跑得比年轻的热火还要快总之还是要稳扎稳打在没有取得第四场胜利之前一切都还未可知湖人加油放一张詹姆斯在中场结束时的超强背扣吧这是三旬老汉吗怎么这么轻松最后老规矩今天放几张詹姆斯的超级绝杀图
墨问前程,哥几个是住在知乎吗回回比赛刚结束东西就出来了最狠的是哥哥们是怎么在一分钟里面写字的边看边写嘛我看了下内容咱别把竞争变得这么恶劣吧实在有点不敢恭维啊唉怕得罪人就不多说了一点建议吧如果德拉季奇就这么伤退了那热火这轮系列赛对于热火可太难了完全没有接触却足底筋膜受伤说明是长期大量消耗终于到今天撑不住了实在是心疼啊德拉季奇太难了年新秀里的二轮秀明明都在季后赛打马刺证明过自己了末节分结果一会儿被太阳卖到火箭又被太阳买回来终于转会热火了勒布朗离开了波什得病韦德还去过公牛就他这几年死守在这里默默无闻的带新人好不容易啊好不容易跟着一帮棒小伙一起打决赛开场正欢腾的时候受伤以后还一直装着若无其事的抢了个篮板因为巴特勒刚进了个三分还想着推反击脚步有点异样受伤了想下去看下结果发现应该能硬撑一下啊结果下回合发现明显没法发力了一直假装没事斯波看出来了把邓罗换上来了新球迷朋友们可能不知道德拉季奇对于我这一代看球的球迷来说意味着什么样的角色他和罗斯一届的自然和威少也是一届的但是因为那届选秀联盟里有人说双能卫的时代要来了事实上当时遍地都是特别强的双能卫一直到库里在和科尔合作后逐渐成熟双能卫的地位被推至巅峰你想德拉季奇来到太阳和纳什一样白白净净的打球也是又聪明又漂亮自然有很多人对他寄予厚望打马刺季后赛太亮眼马刺是太阳的头号仇人我一下子就记住他了一直觉得就算二轮秀也会有好的发展结果王八蛋太阳就一直在摆烂一直在摆烂打也打不过也看不出来啥体系也不找巨星就天天人家罗斯都了威少都打总决赛了他还只能一个人为了常规赛多赢几场拼命二轮秀就这么不配被看见吗也许当年马刺不一选到他就送到太阳就好了唉完全可以接帕克的班啊就是这样一个人勤勤恳恳年终于热火看得起他不让他打替补不拿他换别人终于要打总决赛了就这么伤了他能甘心吗我都不知道德拉季奇怎么面对这种时刻太过分了命运啊你收收你的杀猪刀吧不知道该说什么昨天还把之前一篇回答里关于他的的内容删了觉得写的不好想等今天好好说说的就不能让我赞扬下他吗我愤怒啊唉唉我简直要气疯了所有人都下滑了除了他都可以说都巅峰不在了那个时候被吹上天的梅奥都去辽宁了你就不能给这些快被遗忘的人让我带起一点笔墨去勾起一段回忆吗我真是恨死这该死的伤病了还好阿德巴约伤不大巴特勒也没事但是命运为啥独独对这么狠啊唉不说他了在寻机会写一写这些了不起的后卫吧今天我比较奇怪的是斯波不上奥利尼克和阿德巴约双高却要用克劳德防浓眉也太不尊重他了沃格尔照顾霍华德情绪毕竟上个系列赛打的那么棒你不让他打首发他肯定会很生气但是打热火这种借用投射来争取突破和空切空间的队伍来说其实真没必要上霍华德他跟出去补三分板也抢不到人也防不到我们也看到了但是你用克劳德防浓眉几个意思真就不拿豆包当干粮吗人家沃格尔下詹姆斯上隆多就是指名道姓告诉你斯波你有点搞不清楚状况啊那我就用浓眉单核揍你看你顶的住不我们今天开场也看到了人家热火时拿出了要拿下比赛的决心的一开始就毫无保留的拿出了我在赛事预测上写的他们一贯拥有的狂野劲头赛季热火凯尔特人晋级总决赛如何评价这场比赛一切的转折都是在伊戈达拉在浓眉头上补扣以后开始的不要说湖人场上队员被激怒了连我都被激怒了我们已经淘汰这个联盟内线第二强的队伍了你还瞧不起我是不是就觉得我们外线进不了死缠着浓眉然后仗着三分投死我啊你比火箭还横吗有没有好好看我们的比赛录像不知道这五个人都能突破能传球吗这么不管不顾的包夹等死吧你个两个神经病上五小揍得就是你的五小暂停回来斯波很倔强啊回应湖人三分战术可以你是老伙计睡凉炕火力还挺壮啊你不会真觉得这俩人脚步比浓眉快吧人均斯马特跟你开玩笑的还敢跳都这个局面了你还不上奥利尼克就上个阿德巴约行今天就给你安排的明明白白詹先生拜托了几斤几两啊伸着手有用你知道以前老詹都是被人怎么安排的吗你那防的住有鬼了你还敢上琼斯不会吧我头一回见过有教练遇到勒布朗不想办法增加高度的还斯波了解勒布朗他了解个锤子了解真把自己当小牛了还打长轮换这货色也配打总决赛老詹热火第一年斯波就是老上个乔安东尼在那边用后面才想起来找鸟人安德森现在你底下有个奥利尼克不用你上琼斯这就是名帅嘛爱了爱了知道我为啥所有回答里都不提热火的联防吗因为你打湖人你敢场场守联防你绝对被送走湖人虽然三分不是特别准但是人家空位总能进吧湖人每个队员都能快速出球你敢联防你就等着被打死吧真当这帮被老詹和隆多喂得越来越准的射手永远就是那个德行吗你队伍里的克劳德和希罗还有邓罗不就是被巴特勒和德拉季奇联手加上你们的阿德巴约的策应一点点把自信找到的湖人太棒了他们真的像我期待的那样表现出了团结这配合有几个队伍能打出来的就这帮人不走明年更准给我看傻了你打雄鹿知道上奥利尼克打湖人不上浓眉比不上洛佩茨当过勒布朗教练这种夹击质量也敢拿来防詹姆斯真的狂这就是我从来不夸斯波也不跟风说什么斯波了解勒布朗的原因勒布朗是给他面子不拆他的台他要是真懂勒布朗热火第一年就不会一直把乔安东尼留场上那么久现在的斯波还是进步很多了我嘴下留情想看的各位可以看我勒布朗打法剖析的文章热火篇你就知道他以前是什么级别的灾难片了我发现最被东部球队低估的是湖人啊完全就跟没见过不清楚一样服气啊其实这场湖人也就个三分球不算太狠吧最狠的应该是个篮板吧就斯波这个安排谁都不伤你照样输的很惨全员空切大师传球大师好好去看看录像吧打湖人你敢不守盯人你就死的干干净净后来斯波上了奥利尼克和纳恩纳恩光下半场分奥利尼克五个助攻分差本来一度分这分数都是他们俩顶回来的而且是在勒布朗和浓眉在场的情况下但是大家不用再担心这轮总决赛夺不了冠了湖人这种团结的氛围到顶峰了已经加上老詹现在已经再也不会骄傲自满了热火没有机会夺冠了因为现在的湖人真的像我期待的那样和热火这帮球疯子们杀出了个黎明克劳德多余切球动作浓眉想揍克劳德被勒布朗拍拍胸口让他冷静大比分领先也要提醒身边的年轻人防守质量不要下降不要犯他年轻时候被逆转的错误勒布朗从来没这么轻松的打过总决赛沃格尔真是帮大忙了在等一会儿吧各位最好的就要来了如果觉得内容还不错的话可以给点赞赏吗谢谢了
静易墨,字母哥看着总决赛上中距离中的阿德巴约再想想当初被这招打爆的大洛佩斯不禁流下了泪水但希腊人并不孤独一个德国中锋看着那个让自己慨叹阶层差距的男人被碾成粉背脊更是吹起了凉飕飕的阴风天赋与为所欲为之间的距离比勤奋与逆袭之间近得多总决赛的热火打了大概分钟好球在比赛失去悬念后又陪詹姆斯练了一会儿手其余时间除了懵逼还是懵逼他们的确想不到湖人竟然完成逆向半场三分中而全场最佳射手邓肯罗宾逊却一个也投不进希罗在湖人放弃防守之前更是个天坑这个落差大概可以解释为什么是一场碾压局可两边的根本差距又显然不在这在小球时代体型差异已经被射程差异最大幅度的平衡但一寸长一寸强的道理在篮球这个领域依然有效湖人的身高臂展对抗运动能力摆在那热火整体就小了一号对面还有一个活力四射的浓眉和一个沉稳机智的老汉热火在手感都不及对手的夜晚别的也就什么都不要谈了热火击败过雄鹿我们都清楚他们展示出的实力底子而总决赛有一边要赢场才能结束所以你也不能立刻就宣布这轮系列赛后面就没有看点了系列赛看调整的掘金与快船的似乎证明了掘金只是个用来给快船调整巩固充实提高的练习赛对手结果掘金把剧情反转开始上演惊天大翻盘这说明的赛场上任何理所当然的判断都存在风险但热火能让以上这段话在将来回看时显得有先见之明吗热火想让系列赛重回悬念有难度掘金能创造奇迹是因为他们对位上不虚快船自己还有对位优势可以利用又想办法用空切和主角的神奇能力遮盖了配角外线不准的短板这才让他们有机会抓住快船的失常掘金逆袭快船有他们的翻盘点到目前为止你看不到热火对湖人有这样的翻盘点一来他们前场体型吃亏是没法改变的劣势除非用白伦纳德但白伦纳德在防守端除了体型别的都没有这是热火绝地求生才会搏一下的手段而湖人平日就是靠这个优势混的人家的主打能力你限制不了那湖人就会一直活力四射二来掘金有两个主攻手硬解的能力在季后赛上升到了巨星级约老师毕竟久经考验还有对位优势穆雷打杂技球也是一绝有巨星的进攻火力托底掘金才有连续多场比赛的基本盘反观热火的顶层球星进攻端本来就没有这个级别的存在并且头两号球星的对位劣势极大他们能指望的巨星发挥其实是类似希罗在东决时偶然的爆发或者纳恩这场登场后的状态神勇但这种爆发太不稳定在两边实力均等的局里有人爆发才会改变平衡现在热火对湖人的形势是他们得需要有球星稳定托底才可能跟对手站到一个高度这就为难那几个年轻人了所以平时很佛系的巴特勒上半场拿到球队最高分对热火来说却未必是好事其他主攻点都不行需要巴特勒给大伙托底可巴特勒就不是每场砍分的材料他的主攻能力更适合在大伙打得还行时补刀打雄鹿的爆发太罕见了这种局面下热火还想在这轮系列赛有所作为对球员来说恐怕得先忘掉这场噩梦一般的比赛过程对斯波来说他则要重新制定系列赛计划热火这场拿出的一些东西证明了他们的思路还停留在东决最典型的就是进攻端很有用的奥利尼克上半场并不在轮换之中而下半场被启用后即使他就进了一个球奥利尼克也证明了他值得获得时间那么接下来斯波应该做的就是应该做的是应该做的是好吧太难啦我也是一脸懵逼呀热火最大的问题倒不是兵败如山倒而是没试出什么东西下半场伤病爆发热巴和德拉季奇都退出了比赛德拉季奇足底筋膜撕裂总决赛基本打不了了热巴下一场应该能打热火最后靠纳恩和奥利尼克的二人转把比分追回来很大程度是因为湖人松劲了等第四节詹姆斯想下去休息了直接连打两个也不费力说明热火后来摆的小阵容在防守端也不能真的限制湖人我能想到的大概是三点第一热火要根据湖人的轮换去做轮换在体型上尽可能对得上阿德巴约跟着浓眉的时间走在霍华德不在时要保证由阿德巴约对位浓眉热火要尽可能快的让沃格尔把霍华德换下去虽然霍华德在场时热火这场比赛赢了分但只要他不出大问题他在场就能狠狠的搅和增加阿德巴约的犯规风险和体能消耗霍华德就像湖人的一道安全锁只有让湖人不敢用他时湖人才更接近他们的终极形态如果热火连湖人的终极形态都逼不出就不用谈赢球了开场热火对霍华德的针对就很有效要维持如果系列赛到了热火绝望的时候会不会尝试奥利尼克首发这种奇招呢第二热火不要被湖人的三分球吓倒你可能会说湖人现在这么准热火再放湖人外线会不会死得更快的确热火放湖人外线是个九死一生的局面但且不说弱点会被詹姆斯点名就是强点也未必能一对一防住詹眉热火如果不放湖人外线那就是十死无生对低位持球人积极的协防依然要跟上把漏外线的问题交给轮转速度另外联防打湖人不好用这点在前瞻里我们也能想到但在詹眉只有一人在场时还是可以尝试一下联防如果怕球队的白人射手无法兼顾底线那么可以改一下联防站位让两个锋线防守悍将站下线赌湖人弧顶三分没那么准甚至他们可以考虑一盯四联对付无詹时的浓眉第三进攻端不要挑战浓眉也不要摆过于拖空间的阵容德拉季奇退出系列赛之后热火少了球队最好的挡拆发动者纳恩的高光未必能带到但好歹热火有这么个人能用也是一点慰藉当湖人摆出浓眉打中锋的小阵容时热巴的牵制力显然跟约基奇差远了直接跟热巴配合挡拆挑战浓眉就跟凯尔特人挡拆挑战热巴是一个效果想改变这个局面要么热巴打出中距离统治力要么就让其他点更多参与战术另外当浓眉在场时还是不要上三个拖空间点伊戈达拉索罗门希尔小琼斯这样的用法过于性感浓眉会让你知道什么叫无情的再打打看吧热火输得太惨还没嚼出滋味就结束了对分析者来说这种球也不好解读希望热火在拿出不同的面貌毕竟系列赛不管怎样都要至少打场谁都不想一轮系列赛的唯一悬念仅仅是两大巨星谁能拿到吧
纸谈风月,憧憬了一个赛季当湖人真的回归总决赛的赛场还是有点恍惚总决赛科比元素实在太多让人心绪在这十年间来回穿梭迟到十年的火湖大战这场比赛掐头去尾真正最有参考价值的就是第一节后半段在这半节时间里双方基本盘的差距尽显因为第一节前半段双方都在试探试探过之后湖人拿下霍华德而第一节之后湖人的三分准的离谱这显然不是常规水平不具有可复制性这场打完有几个事实可以确定了霍华德不像赛前想象的那样适合在这轮系列赛发挥因为阿德巴约不是约老师至于他的护框加成和防阿德巴约时的漏洞互相抵消之后利弊如何权衡还得多观察之前说阿德巴约让浓眉的游戏难度从入门提升到中等现在看似乎也构不成太大限制浓眉今年的季后赛之旅应该会是一路绿灯湖人优势比赛前预测的更大湖人变化空间很大比热火手里的牌多很多浓眉的摇摆属性以及老詹的掌控力赋予了湖人各种不同的拆解方法随着比赛深入老詹会越来越多的用挡拆错位点名战术打热火几个小后卫赛前首发一出来沃格尔思路很清晰希望立足于詹眉的基本盘同时利用内线双塔让对手阿德巴约顾此失彼然而试过之后发现虽然浓眉大打小毫无压力然而阿德巴约几次利用速度吃霍华德湖人这边也显得办法不多基本抵消了霍华德对内线护框的加成于是打了半节落后十三分沃格尔果断拿下了霍华德第一节后半段就是湖人利用詹眉的优势不断冲热火内线浓眉各种摇摆错位热火确实解决不了第二节随着詹眉为基础的优势兑现湖人三分全开这时候基本就已经不具备参考价值了浓眉老詹准三双典型的湖人式胜利如果不看三分命中率的话东部好不容易摆脱了詹姆斯的阴影探出头呼吸呼吸新鲜空气刚一抬头这货又从西边出来了果然老詹到哪个半区哪个半区就弱后面的比赛第一重点是避免受伤这才是最大的变数单看这一场热火应对空间不大我们且看下一场热火能拿出什么变化离最后一刻又近了一步原创不易欢迎关注纸谈风月每日赛事分析及篮球实战技巧首发于公众号野兽十日谈诚邀关注
