author,content
江景嵩,有天赋真的可以为所欲为看完热火对湖人的第一场比赛也是始料未及赛前大家都知道热火应该打不过湖人但是没想到全场比赛直接就给打花了纵观全场给我留下一个非常直观的印象就是有天赋真的是可以为所欲为的呀篮球说到底真的是长人的运动当对手比你高比你壮速度也能跟得上的时候那么你真的就处处受制了全场比赛热火除了开场霍华德在场的那几分钟能够攻破湖人的防守从湖人开始打小球阵容以后真的是拿湖人的防守没有太多办法跟赛前预期的一样热火的强项在于传切配合当湖人让它传切打得困难甚至打不出来逼着你一打一的时候热火目前看来并没有特别好的破局者重点说一下浓眉因为有么浓眉这一支湖人可能是詹姆斯呆过的球队里防守全面性最好的球队了因为有浓眉他们的防守阵容可以随意切换浓眉能够从防到的属性再加上詹姆斯从防到没什么问题再配合湖人那几位水准之上的防守者打造出了目前这一只湖人的防守湖人通过这场比赛向世界宣布小球阵容内线的终极答案在我手里你能奈我何再加上勒布朗当年在热火可没少站小球阵号位当年那只热火的防守有多好那现在这支湖人的防守局限性就更小了湖人从进去季后赛到现在浓眉已经向全世界展示了他有多强大湖人已经找到了浓眉的正确打开方式应该说詹姆斯已经彻底找到了浓眉的打开方式估计做梦都在想真香呀浓眉估计是詹姆斯职业生涯中搭档过的最适合他的球星我们都知道有詹姆斯的球队进攻不用太过于发愁的把球交给他进攻效率就有保障现在我们也看到了当詹姆斯在一直防守强队里又是一直怎么样的体验本身历史级别的攻守转换能力再配合强力的防守简直如虎添翼比赛中经常能够看到詹姆斯一传到位浓眉轻松扣篮浓眉开到湖人在季后赛里走得更远了当你能够一直赢球的时候你的能力才会被大家认可这个浓眉大眼的其实一直就这么强但是以前的他不能赢现在一直在赢世人才开始感慨浓眉的强大防守端没有明显短板优秀的防守位置感灵活的防守脚步简直就是小个后卫的噩梦热火的后卫跟开拓者的双枪那绝对是没法比的但是大家也看到了双枪在戴维斯长臂的笼罩下有多难受还有第二轮的穆雷也是一样所以下一场热火的后卫们不要总是想着去挑战浓眉了千万不能头铁虽然我现在也不知道热火应该怎么样才能赢球所以只能感慨浓眉太过于了本来指望阿德巴约能够对的上浓眉但是事实证明浓眉是更强一个档次的球星而阿德巴约遇到了更高更快更全面的自己也只能仰天长叹既生瑜何生亮啊季后赛到现在估计沃格尔教练爽死了手里有两个王变形金刚一般的戴维斯和勒布朗可以让他尝试各种阵容搭配果然是两个王随便配都能赢呀当一直球队有两名一阵球员的时候那么这支球队确实是很难防守的巴特勒很强的巴特勒也很硬但是巴特勒的天赋跟对面那两位比还是有差距的阿德巴约也很强是减弱版的浓眉但是浓眉会告诉你什么叫终极答案会告诉你为什么我是状元而你只是顺位所以有天赋真的可以为所欲为的比你高比你壮比你快技术还比你好想要弥补天赋上的差距完成逆袭这个难度太过于巨大希望热火下一场能够好好打不要气馁一定要打出自己的风格湖人有优势但是两队的差距绝对不至于像今天这场比赛感官上那么大这个时候需要热火的年轻人站出来了放手一搏最后沃格尔对着波斯教练会心一笑不管你出什么我都出詹姆斯戴维斯心里可坏了这俩太好用了
CL梦,我只是单纯的觉得就冲着老科今年也得拿个总冠军
Hey-Michael,在回家的路上看球差点赶不上车岁月荏苒那年沃格尔在对面带着乔治希伯特韦斯特狙击热火三巨头三年年年被詹姆斯干翻最后人走茶凉吉米遇到詹姆斯一碰就碎多年前在公牛数年前在猛龙四比零被打的自闭突然有点心疼八年后又是沃格尔对斯波但是这时候沃格尔手握三个总决赛满级号对线斯波的一个满级号沃格尔满级号真好玩总决赛关键时候看的更多是经验论经验的话湖人那几位的经验都能抵上三支球队了哦对了还有一哥从勇士到热火或成老詹晚年的最大对手最后喊出那五个字国庆节快乐
阳关雪,别的吹的太多了我只想说一点本场比赛热火的关键球员受伤都是疲劳伤不是垫脚对抗追防时候受伤但是反过来想想湖人这么一支高龄的球队打到总决赛伤病不算太严重说明主教练团队在排兵布阵轮换安排方面真的有两把刷子当年骑士的詹姆斯是真的强硬连续打成那种强度场场爆炸也能撑到最后一场
种纬,唉现在的怎么防守强度这么低啊季前赛也不能这么玩吧感觉就是放开了投生比谁命中率高唉不好看
andrew.tsui,如果和阿德巴约算是对面詹姆斯浓眉是
jueves halo,热火联防遇到湖人三分爆种上半场湖人人进三分这还打个鬼的联防我估计中场休息的时候热火更衣室都吵翻天了真正艰难的地方是没有联防就藏不住德拉季奇希罗邓罗这几位进攻优秀的球员的单防弱点打人盯人换防被爆单点夹击被爆三分或者内切热火确实是一支战术执行能力很强的球队但毒酒只能选一样这是没办法的事情浓眉真美国之子
大白,因为这个人今年湖人总冠军因为这个人今年湖人总冠军这是我在比赛前发的一段赛前分析
埃苏,热火出现的伤病总决赛大概率没了预测湖人热火还是稳勒布朗的幸亏勒布朗把天赋带到西海岸不然谁知道湖人还要沉沦多久
眉间尺,浓眉依然很难解决对比字母的冲击浓眉解决的问题很简单就是持球后仰跳投热火阵中没有一个人能干扰到热火有点过于迷信伊戈达拉的防守能力说实话老伊戈达拉上场对自己球队的进攻伤害也是同样大斯波是了解詹姆斯的但是他居然选择包夹了詹姆斯第二节让我想起来掘金打快船第七场第三节约老师用出色的出球的能力狠狠地教训的快船而詹姆斯也是一样
那些少年,不得不感慨詹姆斯年职业生涯每一点都差点运气今年是找回来了气贯长虹的湖人今后两年都是争冠的大热门只要詹姆斯和浓眉不受伤未来是他们的
tony,纯实力的差距
蜉蝣千里,我们尊重每一个努力的球员从不低估一颗总冠军的心但是现实就是比你有天赋还跟你一样努力你拿什么去赢各个位置兑子都差那么一点点就是这一点点加起来就是质变湖人便秘了整个季后赛的外线投射今天上半场全都顺畅了湖人一个主打内线的球队今天内线比热火得分低没办法外线投开了没有奇迹了热火无了最后一句老詹你就刷个助攻吧差一个助攻三双逼死强迫症啊
小鹿丶,看到加嫂穿上蜗壳球衣有点泪目屏幕里一堆大佬
罗俊彦,这是不让詹黑们过节啊赛前就能预测到战果毕竟湖人阵容甩热火几条街詹眉领衔冲锋陷阵隆执导在后场运筹帷幄内线则有魔兽争霸杜德利库克卡鲁索字母哥的兄弟等一众巨星也只能坐板凳席再看热火第一节双方还算有来有回第二节湖人打出优势第三节拉开近的分差第四节完全是垃圾时间了可以去厨房帮做饭了这轮总决赛基本也没有悬念了阿德巴约肩伤其实是自己主动发力顶霍华德想造犯规吧但把自己弄伤了巴特勒崴脚德拉季奇拉伤外网新闻说蛮严重的可能赛季报销热火本来就是一只全民皆兵打团队配合联防的草根球队现在几个首发兼战术核心球员都伤了剩下的新兵蛋子罗和蓝领罗宾逊也掀不起啥大风大浪了向热火今年的坚韧致敬以部第五进入季后赛屠杀了连庄联盟第一号种子淘汰了天赋溢出的绿军一路打脸众砖家名妓杀入总决赛但这一次纵观裁判再怎么帮忙也难阻挡湖人夺冠了如果延续这场的表现浓眉很有可能打破詹的垄断夺下感觉在球权和表现机会风头的分配上詹已经有意在让位给浓眉了贵的东西就是好啊
泽北,毫无疑问湖人很多说这支热火像年的活塞大错特错其实跟年的魔术有点像只是他们的内线阿德巴约跟霍华德不是一个级别的热火的外线防守单兵防守太弱导致热火玩命玩联防看看他们淘汰的球队没一个内线有罚球线处理球的能力没有精准的中距离破不了联防只要湖人霍华德掐死阿德巴约限制他的篮板能力和二次进攻热火基本可以交待了热火的强点是巴特勒和阿德巴约正好对上詹姆斯跟浓眉所以啊热火比较悲剧被湖人天克个人预测湖人基本四场带走场场大比分领先戴维斯
小钻风巡游女儿国,来先夸夸詹眉这对基友进入状态很快詹姆斯开局打的很硬气老汉明摆着要给前东家点颜色看看嘛这局搞得定首节热火也很卖力快速打了一波小高潮首节比赛湖人一度以落后热火但没有保持住首节末尾更是让湖人回敬一波的进攻高潮快结束时卡鲁索一个底角三分将比分反超热火太难了内线被湖人统治了湖人的外线出奇的没有拉胯上半场直到第三节前半场的命中率高达今天的詹姆斯浓眉魔兽表现不错魔兽虽然靠着罚球只拿到分但还是狠狠的恶心到了热火比赛第四节湖人进入划水状态全员开启打铁模式詹姆斯还差个助攻就可以拿三双硬生生的留在场上刷数据嘛反观热火仍没有放弃比赛开局分钟就有分进账但无济于事改变不了输球的结果今天的大跌眼镜比赛过早进入垃圾时间两队分差最大扩大至分有点错失总决赛的水准老汉今天还是蛮轻松的过早开启划水模式刷数据拼命拼命传球比赛剩余分多钟这给老汉气的你们倒是给我俩助攻啊让我打卡下班啊湖人队友好似没有老汉的点逼着老汉近乎打满全场时间本场比赛詹姆斯出战分钟投中得到分篮板助攻这也是詹姆斯继年赢下对阵独行侠的总决赛首战后首次赢得总决赛可惜了直至比赛结束老汉还差一个助攻么一言难尽看着詹姆斯的那吊样斯波教练脸色凝重满面愁云还有巴特勒就是个拼命打工仔脚踝都受伤了还那么拼命出战分钟中三分中罚球中得到分篮板助攻抢断本场比赛詹眉这对基友合砍分轻取热火先拔头筹据统计湖人本赛季在三节领先的比赛里保持着胜负的战绩
yearii,需要湖人夺冠现在球员的上亿美元合同满天飞但的商业前景远没有球员工资增长快前几年体育赛事泡沫在今年将一个一个的破灭
西门有点雪,今天湖人是以非常规方式大胜了热火但是有时候你赌湖人三分不准其实和三分准都有一定概率准的时候你只能咽下这瓶毒药但是这场比赛还是能看出一些问题的今天第一节热火三分非常准一下子就打出十三分的高潮我以为湖人会有点被动但是分钟以后湖人换小阵容热火一下子就被湖人三分追回来了今天的巴特勒在我看来已经超水平发挥了前两次三分全进这效率真的无敌第二节我看出来了戴维斯就是万能钥匙根本不怕你热火的联防但是热火你必须三分非常准你才能和湖人对得上阿德巴约不管打浓眉还是打霍老师都会被消耗非常大最后自己的受伤复发了今天的热火也太拼太紧了导致一下子就伤这么多人还真不是湖人的问题就是自己打得太僵硬伤的我个人是不希望有人受伤的但很遗憾没人受伤的话这一场热火也基本上交代了更可怕的是今天詹姆斯使用的点名战术更是搞笑你罗宾逊守下我就掩护交叉错位打低位你罗宾逊守上我就直接对上你当詹姆斯面前是罗宾逊或者希罗时热火的联防就很危险基本上就会让詹姆斯随便突进去要上篮要分球看心情现在我真感觉完全体的热火已经完全不是湖人的对手了湖人不是凯尔特人湖人有着季后赛全联盟最好的防守效率而且防守除了锋线稍微弱点几乎没有任何弱点所以这就能理解巴特勒可以发挥了阿德巴约面对浓眉加霍华德根本没有任何办法热火唯一能赢湖人的方式在我看来只能是赌湖人三分不准的时候自己三分又非常准这一种情况了基本上差不多已经大势已去了热火的进攻看起来还没有掘金有章法所以平民球队在真正的超巨面前也只能投降了
渊亭,这个吧两队差距没有比分显示的这么离谱战术上我也没资格说什么战略上热火是有问题的之前预测过一下如果热火是莱利说了算那一定是包夹詹姆斯放浓眉外线单挑如果是斯波说了算那就是包夹浓眉放詹姆斯点名两个战略各有优劣没有高下之分结果热火来了一个全都要詹姆斯持球包夹詹姆斯浓眉持球包夹浓眉我靠啊看不懂咧都上包夹那就只能德拉季奇一防三了啊这不是搞笑么果然湖人发现热火这么非主流换下霍华德上了空间阵容直接把热火射穿了这场湖人三分准的不像话固然有运气因素主要还是友军得力真不防啊如果热火三大主将健康问题不大的话接下来还有的打从这一场来说包夹詹姆斯是绝对不行的不如让克劳德去单防他随他抡好了岁的人了抡不了几下了浓眉出球能力比老詹弱一档可以尝试上包夹逼他做一些冒险的出球选择热火想赢首先要控制的不是詹姆斯浓眉而是湖人的外线说难听点话湖人射手群几乎没有持球进攻能力稍微给点压力就只能再传出去组织进攻耐心点他们会恢复到三成上下命中率水平的现在的问题是没有樱木的湘北想赢下泽北换了牧绅一的山王难了啊
石一页,总决赛不好意思有天赋真的可以为所欲为全场三分球投出的命中率时湖人真的无法阻挡一开场湖人还是用了大阵容而热火真的用克劳德去顶浓眉其实效果还不错第一节上来热火通过夹击强点和攻击霍华德的挡拆一度领先分但当湖人上小阵容时问题就出现了由于防守端无限换防热火很难靠传切打出机会而湖人的空间变好了的同时浓眉去对阿德巴约就相当于彻底解放了浓眉的护筐能力于是湖人反超了其实今天热火的防守策略没有什么问题在不可能按住两边的情况下两权相衡取其轻放掉湖人角色球员的外线是没问题的今天湖人上半场三分球投中显然也是小概率事件下半场他们就连续投不中了至于浓眉内线的强打和勒布朗的点名这没有办法有天赋就是可以为所欲为但热火可以做的更好的是今天由于湖人太准热火下半场有些犹豫了防守开始外扩结果就是内线也没防住他们还是应该更坚决地死守内线毕竟湖人的外线不可能场场这么准而内线的高度是热火的绝对劣势他们作为实力较弱的一方不仅要自己不犯错误还要等待对手犯错误就是等待湖人角色球员的命中率下降还有热火想要赢下强大的湖人就必须投的比今天更准今天他们只有的命中率当他们投出的外线命中率的时候他们才有机会赢当然我们说起来很容易但要做到很难今天看来热火面对的困境可能比我们想象的还要大他们必须要保证基本盘的发挥还需要奇兵的出现
GrandFissure,比赛内容各路大神都分析的十分透彻了我也就不献丑了而且这次总决赛适逢双节假期估计大家伙都观看了就不多赘述我就想随便唠两句第一是浓眉的菠萝头型太有喜感了他是菠萝皮霍华德是菠萝的根哈哈哈第二铁林嘴被都碰出血了但他还是笑得像个铁憨憨看来能投进几个三分心情很不错有梦回的趋势了哦第三奥利尼克这个比打球的习惯真是不好特别喜欢拽胳膊生怕他把浓眉的肩膀搞了亏得是火花和他对位而且火花身体是真的牛批阿德巴约之前在东部屡试不爽的身体硬吃在火花这翻了车但愿他的肩伤影响不大期待后面的表现第四赛前大家都在担心湖人的伤病隐患没想到热火这边先出了问题而且好几个都是非身体对抗的令人遗憾希望下场都能复出不受伤病影响第五是不得不吐槽这次的场地了我没看多少比赛但我看到的滑倒就有七八次了这次季后赛崴脚频发场地的锅是摔不掉的了最后哈希望两支球队保持全员健康发挥自己最好的水平不管输赢两支球队都值得尊敬
Herry,简单写两句开局热火的策略比较明确你湖人不是摆双塔欺负我内线无人吗我就把你的塔打下去于是热巴挡拆或手递手一门心思锤霍华德欺负霍华德外线脚步跟不上于是效果显著开局热火的外线多点开花巴特勒德拉季奇齐开火克劳德三个三分球两个暂停过后湖人调整战术浓眉站一大四小逢掩护即换人破解了热火针对大个子的战术且四小的跟防速率足以追上热火的无球走位热火再无法得到开局那样轻松的三分出手机会且霍华德的下场并没有影响湖人的内线统治力浓眉在内线依旧翻江倒海再加上湖人本场的三分手感炸裂内外两开花半场结束湖人领先分整个上半场除了开局首发霍华德再没上过然而下半场伊始湖人祭出了夹击持球人的防挡拆策略热火的外线攻击群再无法舒服地攻击霍华德湖人的内线优势进一步加强此后的一段时间热巴估计杀人的心都有了浓眉一个就够受了现在再来一个心态失衡的热巴连续的中距离抛投无一命中最后一下强怼霍华德结果空中失衡摔伤了肩膀第三节分差一度拉到分比赛丧失悬念本场比赛虽说是湖人的外线吃了一顿饺子但内线的优势是实打实的篮板球同时在浓眉站号位的阶段湖人可以兼顾对热火最强点的限制和自身内线的优势热火本轮系列赛的形势和韦大爷的表情一样不乐观
甜蜜小点心,第一节不太像总决赛啊第二节马马虎虎算季后赛吧第三节我真的不是在看常规赛第四节不看了分明是季前赛德拉季奇足底筋膜撕裂大概率系列赛报销愿他早日康复愿所有伤病都由莫雷承受
藤常生,没来证明自己詹姆斯永远不会在知乎得到认可
观澜阁阁主,如果老詹还能带队拿下总冠军可能就是第一个带三个不同队夺冠的球星了不知道詹黑们还如何看待大腿论
文刀流,湖人用天赋摧毁了热火热火看起来非常无助湖人开场用霍华德打中锋面对热火的挡拆没有及时换防轮转不够快让热火内外开花一度落后热火分之后湖人扯下霍华德让浓眉打中锋遇到挡拆坚决换浓眉休息的时间段詹姆斯负责协防篮下进攻端詹姆斯大量点名邓肯罗宾逊和希罗遇包夹分队友就这样湖人锁死了热火的进攻也打穿了热火的防守从第二节开始面对湖人的天赋碾压热火看起来只剩下无奈当然热火在下半场还是做了一些调整一度把希罗和邓罗换下场用了每个位置都能防的多锋线阵容这样詹姆斯确实不好点名了但热火的进攻没法看然后热火又把之前被弃用的奥利尼克和纳恩拿上场迫近了比分但这跟湖人防守端的松懈有很大关系需要注意的是湖人这场早早打花了热火也有三分超常的因素在上半场三分中太可怕了湖人后续的比赛可能很难维持住今天下半场命中率就回调了下半场中不过湖人三分即使不准热火恐怕也不一定能赢湖人因为湖人统治了禁区这一点从篮板数据上就能很直观的看出来此外热火的德拉季奇阿德巴约巴特勒今天都遭遇了不同程度的伤病真是屋漏偏逢连夜雨愿他们无恙
泼茶香,最新消息德拉季奇足底筋膜撕裂总决赛应该是不会再上了
90后机械狗,虽然我们总是在讲竞技体育的无限可能性不到最后一刻不要定下结论但不得不承认这个不太平的赛季基本只剩下一个悬念了谁是勒布朗还是浓眉德拉季奇阿德巴约三位首发均有不同程度受伤个人认为这并不是偶然和我许久未打比赛上场的感觉是一样的打得太紧了反观勒布朗十年九进总决赛的宝贵经验体现在赛场上便是从容镇定脑袋清楚手脚跟得上脑袋知道什么时候做什么放开打脑袋清楚一些别上头这些在我们乡镇篮球比赛中挂在嘴边的话同样适用于同样适用于总决赛看似简单的道理教练也重复了无数遍还是需要自己一步步走过来不论是东契奇米切尔还是是勒布朗杜兰特甚至乔丹新秀合同期间该交的学费还是要交的不同的是有人交着学费拿到了毕业证比如乔丹勒布朗有人却最终肄业比如卡尔马龙巴克利艾弗森保罗纳什毕业名单上的人数总是远远小于肄业名单人数勒布朗终于有机会把十数年前的那句未来是你的还给邓肯罗宾逊了生活总是这样当你用尽了一切努力头悬梁锥刺股心中有一万个不服别人只是在按部就班地做他们在做的工作本以为可以五五开结果抬头一看分差已经来到了
妖怪吧丶,我已经预测到下一个热门话题了赛季总冠军是不是最没有含金量的一个那些年有人说伤病也是比赛的一部分对吧老詹今年的季后赛这么轻松我是没想到的辛苦了那么多年终于可以躺赢了最后希望球员都健康好好的完成一轮精彩的总决赛湖人可能会被质疑胜之不武但毕竟湖人总冠军完事
不吃丝状土豆,很多人都说湖人赢在三分爆种但是这不就是热火夹击詹眉的代价吗
花衣裳,他去对面了
呱呱,还是要小心伤病一次就足以改变结果双方都要加油健康的比赛
工藤静香,湖人牛批牛批
匿名用户,热火在硬实力上很难赢湖人场也许他们可以换个思路包夹詹姆斯宁可让浓眉得分在詹姆斯的数据无法得到的情况下看他是否会更多的强行单打当然如果詹姆斯今年只要总冠军不要的话湖人不可能输了
沉默的威廉,身为初哥即便你身上有无穷的力气心里有百变的花样可到了实操都是一样的体验虎头蛇尾过程浑浑噩噩即便热火的领军人物名号也确实够硬但再硬的也是总决赛的初哥尤其相比热火只有伊戈达拉算是见过世面湖人阵中的詹姆斯隆多格林乃至他们不止是总决赛赢家而且是胜负手再加上霍华德等老炮儿在经验上对于热火来说这是与之前雄鹿凯尔特人都截然不同的对手特别是那个男人他经历过凯尔特人的铁索横江经历过马刺的铁壁铜墙经历过勇士的死亡轮转老汉当年推车的时候热火的小朋友们双手还没磨出茧子当然如果独战三英纵然神勇如吕布最后也难免力不能支但如果吕布边上站着典韦呢如果俩人身后还站着张辽许褚呢在季后赛的数据堪称逆天值达到这是什么水平呢巅峰勇士的库里是杜兰特是巅峰的奥尼尔是科比是算个典韦不过分吧此战体现的淋漓尽致阿德巴约在东决几乎无所不能但面对他应该体会到了身上的奥运精神更高更快更强作为对阿德巴约分板回应拿到分篮板助攻盖帽另外还有一个细节值得玩味两队合计上场人谁摘到了最多的篮板还是那个男人套用莱昂纳德的名言板男天照拂岁的富贵老汉百万军中捡漏摘篮板能让他这么做的恐怕只有天空飘来那五个字儿吧遇到比你更强同时更具经验更专注的对手想赢下比赛你要做的就是等对手自己犯错比如他们投丢更多的空位三分
卡拉是只猫,打球最怕遇到的就是对位球员比你高比你壮技术还比你好湖人有两个这样的点还怎么玩
陈旭龙,谢邀两个猫无解几个二也没有用热火的整体篮球已经臻于至善联防威力巨大也抵挡不住湖人的三分雨湖人今天上半场的三分有点神奇下几场可能达不到这么高的命中率但内外结合娴熟老詹还没有进入全力模式第二场会更激烈期待中
嫉妒,你不来点邓肯伦纳德库里杜兰特这种历史级别的球星就想打勒布朗很多黑子说还不是因为多个浓眉我就想问下他们敢不敢让老汉年轻三岁之前打开拓者的时候还有詹黑说勒布朗一来挤走了替湖三少结果替湖三少一个状元胖虎和假日哥还是连季后赛都进不去事实证明找人也是勒布朗眼光更好
呀呀嘿,热火加油热火总冠军
H2-miss,只有四个二才有机会对双王透明人没有更新啦太激动手抖点错了只说一句湖人去取得冠军吧就剩最后一个三振了
dudly,从湖人第一节第二个暂停之后热火就已经开始乱了湖人三分命中率最高时段达到虽然今天湖人不像湖人但是能赢就是好事湖人总冠军戴维斯
