author,content
威说篮球,湖人以绝对天赋碾压了热火小球阵一亮整体高度单挑破坏力无限换防直接在攻防两端统治了比赛湖人使用传统双塔阵容还是小球阵直接决定了比赛走势当霍师傅在场热火连绵不绝的高位挡拆无限针对笨重的传统中锋阿德巴约参与高位挡拆亦或罚球线手递手策应球挑逗霍师傅霍师傅防挡拆上下为难湖人一度落后热火分当霍华德下场湖人使用浓眉为号位的小球阵无限换防拆解了热火的整体进攻绝对高度优势一览众山小詹眉自投自抢制霸篮下湖人使用小球阵结合无限换防一鼓作气浇灭了热火斯波在三秒区疯狂夹击詹眉赌湖人射手群的三分效率但湖人上半场三分球投中全队除霍师傅皆有三分进账万箭穿心詹眉背身碾压吸引夹击为射手群创造空位三分机会又专捏邓肯罗宾逊希罗两个软柿子破联防热火首先防不住詹眉单打和射手群两瓶毒药必须选一瓶其次热火面对无限换防攻不进挡拆传切和无球手递手掩护被无限换防切割为一打一热火没有超级得分手能够持续一打一解决问题分的最大分差不足以完全代表两队的差距斯波眉头紧锁沃格尔一脸平静风水轮流转这残忍的天赋啊巴特勒带伤作战德拉季奇阿德巴约也先后伤退湖人依仗绝对天赋最多建立起分领先优势总决赛首战以单方面残暴碾压告终整场比赛湖人投篮命中率为三分球中热火投篮命中率为三分球中湖人篮板球热火湖人罚球热火斯波始终在三秒区夹击詹眉赌湖人射手群的远投效率湖人上半场记三分球三箭穿心下半场中的三分球回归正常水平射手群表现决定了湖人在总决赛系列赛的上限詹眉稳健的单打能力代表了湖人的下限湖人的三分球在复赛以来始终缺乏稳定性当湖人打出了半场现象级的三分球表现时这支湖人几乎不可阻挡毕竟湖人的进攻模式摆在那热火无人可以单兵对位限制詹眉单打夹击必然产生空位并且勒布朗的出球视野无惧夹击隆多搭配浓眉领衔的二阵容进行中转梳理湖人实际上在整个季后赛的进攻都在和自己的外围手感做斗争能防住詹眉的只有湖人的射手群小球时代无限换防盛行热火显然是受害者之一詹眉能力内外号位全方位无死角扫荡热火主体轮换阵容之中仅阿德巴约一根小球中锋独苗直接对位完全被浓眉压制甚至无法在大莫里斯身上占到便宜热火的整体阵容偏矮又缺少单挑好手在无限换防之中解决问题阵容结构和技战术风格被拥有高大内线以及能无限换防的湖人完全克制团队篮球最怕无限换防联防又最怕三分球平民球队最怕巨星篮球当湖人以浓眉为号位的小球阵能够命中三分球时这支湖人就是独孤求败的代名词这轮系列赛实际上又回到了湖人在西部半决赛的模式湖人变小比赛结束热火的小球还能比德安东尼的五小魔球更豪横吗
沐沐沐,湖人的弱点全联盟都知道外线不稳定分投的不好当湖人分手感好的时候一轮打开拓者的就是模版另外今天热火投的是真不准打的比较好的就是岁的希罗了防守詹姆斯一个然后连进两分第二个还是漂移打板可惜上场时间不多经验也不足今年的夺冠的强烈欲望估计只有快船雄鹿可以相提并论可惜两者已经被淘汰了湖人的目标板上就是场比赛赢一场划掉一个理念是必须赢而热火总的来说还是能赢就赢不能赢走到总决也不错了一开始它们也不是目标直指总冠军今天热火真的铁后面几场估计会有所改善理性去看阿德巴约的受伤强行顶开霍华德导致自己受伤那是因为太想得分了中投分都没有只能硬突而德拉季奇自己假动作脚踝点地伤到了和去年汤普森受伤有些类似强度太大身体机能一时间没跟上就受伤了每一次看湖人最让人感动的还是火花岁月流逝年龄增长让他真正成长变成一个可靠稳重的球星今天给两次篮下传球被造犯规情绪波动也被抑制住了看得到全队对胜利的渴望影响了每一个人这股气势是其他队所缺也无法弥补的湖人一步步走向梦想铸造现实年了真的等太久了当球队真正跨入荣耀殿堂时那个号却无法亲眼见证这真的是巨大的遗憾那个男人本来应该也在有人说希罗这里列一下分肯德里克纳恩分希罗分得分排名第三克劳德分其他人都是个位数一个岁小将今天这得分还不算比较好再者说防守希罗防守确实不行但是被湖人反超后热火全队输分一直维持在分分左右第四节追到下半段最后才追到这防守的锅让希罗一个人背吗热火多次打铁和两队本场的实力差距不应该让希罗一个人背锅吧那么年轻能有闪光点真的不错了还想要啥自行车
努力不负韶华,第一节开局热火太准了半节打完命中率内线外线全爆了感觉被打爆了热巴内线太活跃了外线也神准二三联防有大问题热火的联防也给了湖人外线机会万幸波普的两粒三分球把比分拉回到个位数最后的遮羞布二三联防外线准就完了还要被内切还好湖人调整过来防守强度上来了打了一波大起大落反超比分首节战罢湖人领先分老詹被限制了还没咋打得了分第二节库兹马以一个精准的三分开场隆指导都有三分湖人外线开了热火的年轻球员是真的敢投在总决赛赛场上没有一点怯场岁的希罗连投两三分热火反超比分老詹今天没打开还好暂停后铁林三分开了浓眉哥也来三分卡突突一个上篮直接打停热火暂停回来热火慌了湖人大莫也有三分分差拉开到分年轻球队还是稳不住啊优势稳不住劣势没人得分巴特勒别受伤啊我是湖人球迷但是真心不想看到球员受伤啊唉回更衣室了半场打完本以为热火三分准没想到湖人更准半场打完湖人三分命中率浓眉哥还是定海神针啊可是手指好像伤到了这才第一场比赛啊都不要受伤啊第三节还好巴特勒和浓眉哥受伤不严重仍然坚持比赛点赞巴特勒受伤回来开场来个硬可是这也挡不住湖人的进攻了啊也没有进攻组织者了啊从浓眉哥连抢两个前场篮板开始湖人已经燃炸了可德拉季奇是啥时候受的伤别受伤啊然后热巴又有些受伤又回更衣室了三节打完湖人领先分第四节基本上就是垃圾时间了
风起秋末,比赛还没完比是很小概率的需要詹眉有一人能够击败裁判控场拿出神级表演才成水平差距这么大对是个打击这轮对决最大可能是比控场可能是第三场如果被神级表演击败比也是顺水推舟了补几句比赛感受吧因为是第一场斯波还是有想法想偷一个的所以想包夹詹眉试试湖人射手能力如果湖人投的不好说不定比着比着就有机会但是沃格尔变得也不慢直接霍华德下了上朗多詹姆斯也下去歇了接下来湖人一顿三分雨把热火浇没了这波有点太快没到半节就翻盘了如果一旦没开第一节落后十分后续热火的挡拆和远投不会没有机会也是一场正常打就没得玩了可以预见从下一场霍华德肯定会遇到犯规麻烦两个白人后卫甚至包括克劳德都是詹姆斯的点名对象这一轮季后赛要没有伟大演出就肯定要有反复纠缠这个疫情带来的损失肯定要靠收视率来补为什么说热火没机会呢因为巴特勒其实是走下坡路了今年巴最好的表现就是对雄鹿的到场球其他时间也就是联盟普通明星水平不会真有人觉得巴特勒比哈登还强吧另外就是受伤和恶意犯规克劳德这人对前队友下这么狠手祝愿早点失业
brice,湖人第一节其实是被爆的但是手感逆天了各种强投面前有补防到位的进了空位也极高命中率热火防守其实非常好如果不是外线太准本来分差距应该是热火打出来的大概率防守作用太大进攻和詹姆斯同等的硬解能力德拉下了之后热火进攻就很麻烦了同样霍华德在场区别很大其实不是受伤和湖人手感不正常热火今天还有的打阿德巴约也伤一哥防詹姆斯太好了德拉和伤不同不是急性伤是疲劳伤这个就麻烦了疲劳伤到打不了大概率就一直打不了了能上也很形象表现德拉进攻端作用巨大伤了今年总决赛就无聊了今年要是老詹就要完美了
詹黑别混水摸鱼了,我记得有些詹黑特喜欢说詹姆斯不被包夹是因为不配今天的比赛麻烦看下包夹什么下场哦对了他们不看球的啊
wonder,我现在没别的想法就想看我为什么不希望詹姆斯拿冠军的续集赶快多写几篇让哥开心一下需要付费吗噗嗤热火这场只是夹击老詹赌湖人角色失准的赌博策略失败并不是不可挽回的战术漏洞真正的问题是一系列高强度比赛累计的疲劳压力爆发一场比赛无对抗伤了个核心某种程度总决赛悬念已经不大了
alex张小超,零换整也太赚了吧
城南草木深,詹姆斯咱老李这辈子没打过这种富裕仗热线这就是西部冠军热火也配进总决赛
clida,虽然是一场比赛却是整个总决赛的预演热火队看起来纸面实力不弱但整体实力和湖人差了一个档次开场一不留神热火可以打湖人一个趔趄但缓过神来的湖人就可以很快把比赛带入自己的节奏内线不行打外线进攻不行先防守湖人总有办法在落后的时候拖住比赛在领先的时候扩大战果输了一场球按理说并不代表什么但看看詹姆斯的发挥你就会发现他还真的没有发力打了这么多年总决赛他的经验比谁都多什么时候收着打什么时候该发力他心里最清楚如果这场比赛是靠詹姆斯发力那说明双方实力相近遗撼的是詹姆斯把注意力放在串连和助攻上就已经大比分领先了而且热火还有主力受伤这就不难看出谁在真拼谁没发力拼命的输了比赛没发力的大比分领先这就差距
土豆儿,恭喜湖人成功拿下还差场就是小球时代最适合的号位湖人赢球的两点第一进攻端内线翻江倒海防守端打无限换防热火进攻受挫第二三分火力全开上半场不是单个人三分爆是除了霍华德其余个人都进了至少一个三分一举拉开分差让热火完全不敢守联防也有点不敢再大胆包夹詹姆斯和戴维斯上半场的比赛可以分为四个阶段第一火花首发的前分钟输分由于火花遇挡拆没有无限换防阿德巴约通过各种手递手和挡拆热火球员各种突破三分样样都有热火开局进攻非常凶进攻非常顺畅效率很高火花无法无限换防挡拆只能绕过或者顾此失彼让热火进攻游刃有余第二火花下去之后浓眉打的阶段进攻防守两端立竿见影进攻端空间大增三分多点开花防守端无限换防一举将比分追平反超浓眉无限换防带来的成效波普的连得分第三第二节节初浓眉休息莫里斯打阶段莫里斯也是不换防热火进攻状态又起来希罗刷刷连续两记三分打停湖人第四浓眉再次上场打让热火连续很多次进攻无功而返进攻端的效率依旧不减格林记莫里斯记三分卡鲁索爆扣半场结束比分已拉开铁林第三节的分为老詹出头老詹锤浓眉小胸胸第三节开始之后老詹进攻端各种点名希罗和邓罗火花在防守端也开始无处不在湖人防守反击戴维斯内线翻江倒海火花两次内传内浓眉分差已到分左右比赛已失去悬念依旧是詹眉和内线优势本场比赛篮板领先詹眉合砍分不仅没有防住詹眉还让湖人角色球员在上半场三分火力全开打出自信但是湖人也不可掉以轻心年三巨头合作的第一年总决赛第一场对小牛也是干脆利落行云流水拿下第四节都还领先分但最后时刻被诺天王绝杀系列赛扳成湖人要引以为戒相信老詹经历过那个至暗时刻不会重蹈覆辙工作尚未结束请继续保持饥渴希望隆多波普热巴爪机和的伤病无碍双方能全勤投入真刀真枪给球迷奉献一轮精彩的比赛热火的变数点本场的无奈轮换之举纳恩和奥利尼克看斯波会如何使用变阵还是否会无限包夹戴维斯和詹姆斯更细的分析和动图晚些呈现
准文盲,没太多可说的之前已经预测过大概率小概率故地重游也就是告诉东部那些依然还是渣渣而已东部球员和詹姆斯浓眉在一档的在篮网但是篮网的那位球员未来能打成什么样谁都不知道此外就没有了看好詹姆斯最后一场大爆发拿下湖人总冠军冠军数追上凯尔特人不过下赛季就不一样了西部竞争会更加激烈看交易吧但是一个球队一旦有威少或者乔治基本就可以排除争冠行列了我原本以为一阵一防没有水的直到出现乔治原本以为没有水的直到出现威少
雍和,我们说进攻赢得胜利防守夺得冠军为什么就在于此消彼长如果你防不住对方的进攻那么就没有解决问题的方法进攻的自主在于自己有时候进攻不好可以调整然而防守是被动的在于自己是否可以做到调整的空间就很小了热火的身高不够但是机动能力强所以防守使用无限换防首发使用联防面对詹姆斯戴维斯的进攻威胁使用双包夹面对湖人的内线身高篮板能力使用单人冲击前场篮板其他人回防避免湖人打出转换于是湖人的其他人出现大量的外线机会射手群的投篮基本上是练习赛的强度加上戴维斯詹姆斯策应能力和包夹出球能力强两人疯狂积助攻虽然得分不高只要射手群有命中率保证这个比赛走势就完全控制在心所以湖人出现了詹眉挡拆的杀招之后再次出现一个新的杀招双星四射湖人完全像个人打个人就是两大突分自主进攻能力极强的球员吸引双包夹其他球员原地接球三分甚至于不需要过多的轮转球不需要过多的挡拆热火的战术其实没有错误但是他们的防守对体力消耗特别大而热火的轮换阵容天赋完全不够所以一旦阿德巴约和巴特勒不同时在场球队轮换和终结会出现很多问题而一旦湖人将戴维斯直接放中锋位置热火打不进禁区就只剩下了外围投射而戴维斯的防守面积导致可以一个守篮下又让湖人在外围防守上并不吃亏所以热火无法解决詹姆斯浓眉的持球威胁以导致湖人的无球球员得到大量的空位机会所以真不是热火的执行力问题或者战术问题这就是天赋的碾压巴特勒受伤巴特勒上半场投中三分中让吐槽他的进攻一般的专家闭嘴克劳德的外围同样中是在于阿德巴约和巴特勒在场时创造出大量外围机会而热火除了克劳德能解巴特勒突分和阿德巴约的掩护拿到球其他的白人后卫完全没什么机会德拉季奇受伤而这些机会随着浓眉打五消失了阿德巴约受伤斯波为什么会启用琼斯和希尔都在于热火需要身高臂展移动速度快的锋线来跟防詹姆斯浓眉但是效果特别不好这同样是无计可施以至于奥尼尼克和纳恩这些前面没什么上场机会的球员也只能安排上场实在不行我上詹姆斯高位持球面对热火白人后卫完全不需要掩护就可以突破戴维斯低位持球完全可以练习背身单打投不中也是直接前场篮板再次二次进攻如入无人之境再到下半场热火损伤了德拉季奇少了突破点以至于湖人使用霍华德化身控球控卫多次秒传戴维斯篮下轻松得分当比分拉大到分时丧钟已经为热火吹响本轮系列赛只要湖人三分不再拉胯基本可以碾压夺冠而戴维斯的多半也稳了詹眉联手冠军我有
王大帅,当年东部互相撕咬的几个老炮隆多火花都是一阵的防守水平都是各自位置上最难啃的那块骨头那些年想要冲出东部真要打出狗脑子勒布朗打凯尔特人每次突进去身上最少挂着一个人隆多打热火手直接被压脱臼然后继续上场火花这些年的伤病很大程度是被东部绞肉机的暴力犯规砍出来的更别说那些年的步行者公牛每一个都是又臭又硬系列赛只有站着死没有跪着输关键是冲出了东部到了总决赛一看湖人三高石佛邓肯在里面等着每个都是又高又壮水泥墙哪怕后来詹姆斯统治了东部之后总决赛的场上必然会站着一个肉墩子一样的长人去顶冲进内线的小皇帝让他每次突进来都要付出代价不然后卫线就会被点名战术碾压的手软现在热火队那几个被骂脏的球员克劳德奥利尼克放在当年只有一个字软这些年勇士的王朝让人觉得小球很强热火的崛起让人觉得莱利构想的五个身高两米左右的全能锋线的现代篮球已经降临其实根本不是那么回事勇士小球强因为他们最强的五个球员刚好没有重型内线而且勇士这几个人说起来都是格林的身体能顶的联盟所有内线没脾气水花兄弟的身高超过联盟绝大多数的后卫线组合更别提后面加入的杜兰特更是个超规格的怪物了而且如果勇士有或者奥尼尔这样的内线野兽科尔绝对不会一根筋的坚持小球战术篮球说到底就是场上十个人的捉对厮杀面对凯尔特人的时候身高的热火双子星西螺和邓罗经常可以无视左右的沃克斯玛特直接出手三分经常能获得非常舒服的出手空间好几场球投成了投篮训练热巴面对泰丝虽然身高没优势但运动能力强过对方太多一个试探步就把泰丝过个干净进到内线一片海阔天空巴特勒和所罗门和对面的獭兔杰伦基本兑子了互有攻防但整体硬度热火的锋线要高过凯尔特人半截热火这几个新秀在东决虐凯尔特人的小矮子们虐的舒服呢来到总决赛发现自己撞到了史上最硬的一堵墙上直接就傻眼了今天西螺面对的追帽的时候才想起来自己是个小短手邓罗被詹姆斯点名打的怀疑人生巴特勒所罗门克劳德被勒布朗背身几下就顶到了篮下除了犯规没别的选择热巴被火花在攻防两端爆的怀疑人生发力冲向火花被弹了回来小抛投在最高点被扇飞防守端在篮下像个无助的孩子看对面把前场篮板抢的跟后场篮板一样隆多火花格林湖人每个位置都能给你拿出一阵级别的防守另外还有卡鲁索这样的也是首发级别的防守强度一整场下来热火的球员是懵逼的湖人和热火身体差太多了看两队场上的体型就像大学生对高中生运动能力和身材都差一档的时候根本比不到技战术层面热火五个位置没一个能在对位的身上占到便宜单纯的小并不能提供任何篮球上的优势热火在东决怎么用身体压着凯尔特人打现在就是几倍的被湖人用身体压回来攻受互换的太快了人生就是这么多大起大落为什么抓鸡热巴都伤了系列赛伤病的积累是一方面另外打湖人身体不如对方只能使的劲出来对抗自然容易伤想起我们群里的熟人出来打野球身体好的都要分开不能在一队互相还能对上位要不然真没法玩一句话说能限制湖人队的球员都在湖人队里头呢现在热火唯一的希望就是戴维斯为了抢挑起队内争端湖人突然更衣室爆炸不然总决赛大概率被横扫
Aubrey,多久没见有人敢包夹詹姆斯了和自杀区别不大但话又说回来了也这怪不了斯波热火内线太搓了一眼望去热火里面都是些谁热巴巴特勒伊戈达拉这打锤子呢这不是把詹姆斯和浓眉脸笑歪包夹詹姆斯赌湖人外线不准确实是一个办法但湖人外线一众老将经验丰富赌他们不准太不靠谱了不如就让詹姆斯就累他就让他一个一个的打但这样做要是还没效果很容易让詹姆斯拿
什么来着,当湖人第三节领先到分时这比赛也就没意思了这时候场边的虚拟观众席倒是挺热闹名宿云集也算见证历史了来看看都有些谁吧稳坐位的皮尔斯赛前曾毒奶湖人热火估计此时此刻内心无比谈定结合一下比赛形势真有横扫那味了不是
时光流淌怎么收藏,如果詹姆斯估计知乎要声讨为啥不给浓眉如果浓眉估计知乎要问如何看待詹姆斯抱大腿获得第四个总冠军
木一魔王,球队大胜詹姆斯却不满球队在湖人大胜热火之后他直接点出了球队最大问题在最后一节我们开始松懈这真无法接受甚至詹姆斯还表示年我们在领先分的情况下输球我从中学习到了很多东西其实詹姆斯就是怕最后时刻被逆转这也是为什么詹姆斯一直在球场上的原因毕竟巅峰时间不多了他需要把握好每次机会
岩枭,湖人赢得漂亮热火十分可惜全场比赛看下来除了开局阶段湖人比落后分分差之后沃格尔也是立即把霍师傅拿下把浓眉推到号位换上隆多上场给对手一个新的比赛体验直接让比分翻了回来一波比之后湖人在局势中就一直牢牢的把握着主动权有浓眉眉问题最终浓眉还是成为了决定比赛的最关键因素湖人的防守效率一下就提升上去了遇掩护就换人不给对手空位溜底线的机会让热火凭着球员个人实力来解决问题的时候热火的问题就暴露了热火是一支纪律性很强的球队打的很有战术和章法挡拆掩护跑出空位机会投三分进行终结团队配合很好但是没有一个绝对的进攻强点所以当对方遇掩护就换人身前一直有人防传不好传只能靠自己单打时进攻效率就低了而湖人有两个绝对进攻强点詹眉都需要人包夹那这比赛就很那打了在战术布置上也只能做出取舍包夹一个单防一个而不被包夹的那个就会狠狠的打你比赛中老詹一直叫挡拆换希罗来防自己专打希罗这一点其实也不仅是希罗邓肯罗宾逊也会是如此他们会一直暴露在老詹面前我相信下一场比赛斯波一定会想办法保护希罗这一点浓眉除了担任号位让球队的防守更好之外自己的进攻照样出色一抢三一抢四摘下篮板把球打进在进攻上也统治了热火的禁区热火是真没高度抢不过啊阿德巴约和浓眉的对位这场比赛也并不快乐表现远低于平均水准而同时热火由于忌惮浓眉的存在也不敢大量摆联防球队最擅长的防守方式在最关键时刻却不能用天然的劣势让人可惜换支球队或许热火就能发挥他们之前系列赛的统治力可偏偏遇到的是湖人热火的伤病问题让人担忧希望球员可以以更好的状态打比赛希望伤病没有大碍阿德巴约疑似肩部拉伤德拉季奇脚膜筋伤病巴特勒崴到了脚踝希望双方都没有伤病打完系列赛
例不虚发探花郎,开局热火曾一度领先分无他湖人并没有一开始就打巨星篮球而是像每轮第一场那样开局试探攻了几个点但手感都不算好关键是防守端换防轮转出了问题让热火挡拆后轻松出机会沃格尔教练果断拿下霍华德同时决定让詹姆斯先休息朗多和库兹马上来后轮转防守清晰明快多了波普啪啪两记分止血浓眉开始制霸赛场了等詹姆斯再上的时候湖人已经追上了比分热火再包夹老詹和浓眉两人果断出球湖人今天的外线也给力上半场就有的高命中投进了个分打到这热火已经慌了德拉季奇希罗还有邓肯罗宾逊这些白人外线被湖人攻防两端点名军训希罗虽然第二节有连续两记强硬分的亮眼表现整场比赛也拿下了分可是这是建立在次出手仅仅中还没有内线杀伤的基础上大多数时间就是看着湖人轮流操练着可怜小伙子的正负值也让后的倒霉孩子希罗明白了到底什么是总决赛第二节节末巴特勒崴脚德拉季奇阿德巴约也先后伤退只能说是热火内心慌张反馈在赛场上的写照湖人今天的防守还没有到说铁血的地步就是热火真的缺乏总决赛经验而已希望热火几位球员没有大碍下一场积极调整找到一些解决办法吧第三节打花的比赛看点和讨论点也没那么多对不对湖人这边延续了整个团队从西部一路走来的积极性感觉和火箭那轮系列赛彻底把湖人全队激活每个人都明白自己想要什么知道上场该怎么打波普铁林乃至隆指导莫里斯今天都贡献了适时的分以破热火的联防今天湖人常规时间轮换上场的人里除了霍华德全部进了分远射命中率上去了加上詹姆斯浓眉这两个联盟最好的传球人斯波教练一喊包夹就被惩罚关键是不包夹的话几个白人外线就被轮流军训尤其是詹姆斯这个老头坏得很第四节节末妥妥的垃圾时间还专门叫了两个单打就是杀人诛心就是给斯波教练看你不包夹我我就用点名战术了哦当初那四年你最熟悉的点名战术哦最让人感动的无疑还是霍华德霍师傅一个浪子一个当初本以为自己应该和詹姆斯争夺联盟半边天的傲娇强者飘零流落后终于回归初心开始为自己生涯第一个戒指放下面子甘愿拿着底薪甘当一个蓝领拼尽一切努力看看他抢下每个篮板时振臂高呼的样子看看他第三节给浓眉那两个大道至简的内传内霍师傅祝你自我救赎成功祝你如愿以偿填补当年的亏欠之情祝你顺利拿下第一枚总冠军戒指
