author,content
嵌入式Linux,看杨毅老师的解说我差点就睡着了开局的湖人被打糊了进攻防守都不在状态直接落后分转折点从变阵开始湖人把老詹按在搬凳上然后又把霍华德放下来这两个手笔作用很大直接让湖人活过来之后老詹再上场状态发生了变化隆多投进了好几个三分你们要知道一个控卫三分准起来杀伤力是非常恐怖的这也是非常典型的有控卫的球队和没有控卫的球队相差非常大当然热火也有控卫但是热火没有老詹老詹非常神奇这是一个到号位都可以打的球员而且最重要的是他在球场上的吸引包夹能力和防守压迫能力以前说过一个观点如果没有老詹这个球队也非常厉害但是不至于能打到总决赛这就是老詹存在的能力巴特勒存在几个问题一个是射程太近一个是身体偏矮湖人内线太高了巴特勒打湖人就好像用到了七伤拳更严重的是崴脚了这个让热火雪上加霜啊希望热火下一场变阵打出更好看的比赛
大胖宅男,如果抓鸡以后上不了湖人大概率要横扫热火热火的联防对于东部球队而言确实是一大杀招但是对于拥有中线大杀器浓眉的湖人来说破联防太简单了只要浓眉在罚球线附近拿住球那联防不攻自破要么面对浓眉的单打要么面对湖人外线射手的惩罚两杯毒酒总要喝一杯如果热火不打联防那老詹就乐了今天点名点的不要太舒服邓罗抓鸡希罗被詹姆斯碾压的渣都不剩自从湖人打完火箭现在剩下的队伍里打小阵容的就更不够湖人看的了还是之前说过的热火有一点很尴尬的就是能攻的不能防能防的不能攻无论是什么阵容在场上永远有漏洞遇见湖人这样经验丰富的队伍会被抓住打到死当然热火也不是毫无机会首先抓鸡一定要回来做为队里的得分王和老将比起希罗邓罗这样的新人他的得分肯定要更稳定热火本来能砍分的人就不多抓鸡太重要了其次场上高度一定要提升自从湖人打完火箭就再也不怕任何小阵容的组合了因为火箭打小阵容就是现在联盟里最强的火箭都不能给湖人造成麻烦其他球队更没可能热火可以把奥利尼克提上来今天比赛的后半段奥利尼克在场热火场面就好了很多再次穷人版的老詹和浓眉必须要发挥真正考验是不是硬的时刻到了热巴今年季后赛的中投也非常好下一场两个人要硬要拼还有一点就是虽然是因为热火收缩联防的原因给了湖人射手非常好的投篮机会但是湖人外线的手感今天也是烫到爆炸命中率如此高也不是正常的如果能保持这样的手感那乔丹来了也不好使下一场热火在防守伸缩性上要更快要扑一下尽可能的干扰对方的投篮如果以上都能做到热火还能赢下两场但是就今天看抓鸡的受伤状况是最可怕的无对抗受伤恐怕情况会很糟糕祝福他吧看来今年的总决赛坚持不到放假结束了最新消息抓鸡足底筋膜撕裂这还有奇迹吗
汪小琛琛,我不知道有没有人注意到第四节最后几分钟詹姆斯对浓眉乃至全队是不满意的有几次补防明显不到位他的确连进两球带走比赛但因为浓眉心态的放松全队的放松他多打了几分钟并不是说多打几分钟怎么样了主要是这是总决赛不能因为短暂的领先有丝毫的放松这是打了次总决赛的詹姆斯最明白的道理希望湖人不要因为一场的胜利轻视对方要知道这场是因为你们上半场的三分过于离谱下半场也的确证明了他们的三分延续性很差甚至下半场很多球都投的差很多下一场依旧是硬仗可能会出现和掘金第二场一样的情况而且那时即使其他人松懈浓眉依旧稳住了但这一场明显浓眉也放松了所以到了下半场还能不能有人绝杀救你们就不知道了我还是觉得湖人能带走但如果不能即使醒过来觉得自己优势巨大对面伤了俩大将其他人都不行的话我相信热火也会给湖人教训
周大厨,以后请叫我周指导哇哈哈哈昨天的分析基本都中了挡拆高强度防守使对方射手失准湖人空位三分够准破联防上半场攻阿德让其犯规早早休息保持篮板优势全场超了对手一倍这些都做到了热火这边阿德由于犯规过多没限制住浓眉快速退防是做到了但是用联防赌湖人三分不开没成功用了不少手递手起初在火花跟对方后卫速度不够时很有效果但火花下场浓眉打号位后由于浓眉的高机动性使得手递手也失效了开场时热火相当果断够硬够有气势上来就把湖人打晕了一度打成可惜这是高成熟度的湖人于是第一节湖人就果断改变战术用浓眉打号位上一群球员波普格林大莫既加强防守强度又保证三分在第一节反超后热火的信心就被打散了连空位都不进了从此再没有机会你说我一个球迷都能想到上面这些双方基本也是按这个思路准备的说明什么战术如果都没走错胜败就只取决于实力对比了这俩球队说实在话真的不是一个档次的老詹都没发力汗都没出来这都第四节了真就没出汗说点有意思的观众席要是组个队能拿个总冠军话说这个号新秀是第一次参加总决赛吗都到时间了还攻要不就成本场最佳扣篮了回头有时间我再想想热火该怎么破局我希望湖人赢但我又想多看几场球
何耀荣,作为视频观众的退役球星各个排面足够不过最有意思的还是曾经的绿军三巨头雷阿伦可能还好说像皮尔斯加内特无论是曾经的东区死敌热火呢还是队史上的死敌湖人反正就是看戏热火可能有一个希罗但湖人人人都是希罗常规轮换出场的人当中除了霍华德全部都有三分命中季后赛至今从没有一场湖人的三分开成这样准成这般还是在总决赛第一场的舞台上也算湖人全队给热火的一份大礼三分盛宴湖人对热火的优势主要集中在高度和射程这在热火经历过的季后赛对手中应该是第一次遇见雄鹿有高度凯尔特人有射程但雄鹿的核心缺少射程凯尔特人整体缺少高度和强度热火平均化配置靠着坚固的联防和外线优势对阵二者时都能够对症下药取得优势包括本场第一节热火自身手感外线发炮领先分内外开花现在比赛当中外线无法威胁内线更难打开局面毕竟收缩防守可比扩大舒服太多只是湖人自身状态调整及时第一节的波普两记三分一记中投第二节的皇阿玛两记三分一记中投使得热火的防守疲于应付角色球员零敲碎打湖人两大核心优势尽显戴维斯的单打詹姆斯的牵制戴维斯从三分线到油漆区的攻击范围让阿德巴约十分难受自己作为进攻轴心被四处拉着跑习惯的弧顶到中区传递因为德拉季奇的伤缺球队手感迷失并没有发挥太多作用外线无法依赖频频选择中距离因为面对两大内线围剿而只有投中无法发挥出全部实力另一边詹姆斯吸引防守能力太强霍华德两次助攻戴维斯扣篮都是詹姆斯传球然后詹姆斯霍华德两处吸引至少名球员从而让戴维斯轻松得手结果就是热火的空间越来越小湖人空间越来越大经常可以看到热火获胜是由巴特勒终结而他们失利的标志也同样可以在巴特勒身上窥见一斑当球队前三节开始依赖巴特勒不断单打强攻球队的进攻运转就已经出现问题而当克劳德成为三分线外最靠谱的投手那球队的外线也出现很大问题本场比赛的特殊性在于湖人射手集体暴走热火自身伤退影响进攻端安排打乱从而防守体系出现混乱所以并不会是常态热火的坚韧程度并不会因为这一场比赛而受影响如果后续全员没有大碍还有一战之力胜负还未可知就像第一节攻防来回比较有声色可是如果德拉季奇阿德巴约受伤病影响而退出任何一人热火基本就玩完收割比赛一位外线核心一位内线核心他们就是热火的龙头凤尾希望他们健康归来
单眼皮小王,硬实力差距一个赢得畅快一个输得硬气当然德拉季奇的意外下场算得上是个转折点毕竟他是热火进攻的节拍器能投会突擅传技术过硬视野开阔心态也稳定他下场后热火没稳住阵脚被打了个透心凉最大分差超过分这是湖人季后赛到目前为止最大的领先但有些差距是德拉没法弥补的比如内线东部决赛时阿德巴约在罚球线内予取予求身高臂展力量速度甚至中距离投射都是大优势而且绿军防守端完全摁不住中锋泰斯动辄有犯满毕业的危机热火依靠阿德巴约攻守两端的统治力比赛的后段完全掌控了胜负的天秤可是湖人好巧不巧内线实力独步联盟论防守火花把约老师折磨得气喘吁吁论进攻浓眉就是个外挂阿德巴约往油漆区一站明显小了两号然后热火篮板被爆了个之多热火三分的底气在于轮转和突分当然也来自于希罗和罗宾逊的准星热火内线不占优时轮转和突分就会受限假如射手准星再差点意思进攻就陷入困境第三节就这么被打懵了还是得夸巴特勒属实太硬了连续在浓眉和詹姆斯领防下崴脚一点也不耽误继续突破这种意志力分分钟感染队友第四节初段纳恩替补上来爆发了一路狂追分差最多迫近到分表面上看湖人三分开了花个个都是神枪手其实也一度出现投中的断电内在的原因是湖人内线天然的碾压让热火的防守策略失效相比于掘金的硬扛付出犯规代价阿德巴约只能目送浓眉攻框而投入过多的协防就导致外线和弱侧漏出空位对热火来说坏消息是德拉足底筋膜撕裂大概率要报销好消息是没事会继续硬下去本场比赛呈现的态势来看湖人依然是手握胜利钥匙的那一个唯一的悬念就是总决赛还能打几场有兴趣的就猜一猜吧
segelas,第一场比赛简单谈几句个人的看法面对湖人瞎眼可见的内线优势斯波教练做出了一个看似最正常的选择收缩内线考验三分但是即使如此热火的防守资源依然是不够的阿德巴约与两个三号位组成的前场防守组合中真正能够跟上浓眉的只有阿德巴约而巴特勒和克劳德则要面对剩下的詹姆斯和另一个前场球员从常规赛防守数据来看两个人对于詹姆斯的防守效果并不算好因此势必需要更多的协防此时攻防对位便出现了人员的不对等斯波采取的办法也很简单三个人不够便五个人希罗和邓罗更多地投入到对外拉的浓眉持球或空手的切入者路线的刷卡和延缓上从而缓解篮下的防守与轮转压力至于湖人后场的三分投射点用阿德巴约带队的团队轮转以及希罗和邓罗的看情况回位干扰剩下的就看他们进不进吧然而斯波忽略了或者说被迫忽略了一个关键问题从大样本来看格林和波普确实不准但他们终究也是混迹多年的水准以上投手啊虽然常规防守下不准但当他们面对大放空是不太可能投不进的于是我们就看到了上半场的画面湖人的内线确实被限制了产量但凭借着绝对的高度和人数优势依然给出了不错的五成以上效率得分上也并没有落后热火太多而完全放开的外线则回应出六成以上命中率单项得分反压制了投手众多外线战术丰富的热火十多分里外里热火在外线失血于机会的数量和把握度内线有所控制但也失血于把握度得不偿失看似硬朗实则无用并且湖人还可以用手头的资源作出更多调整上半场沃格尔读到斯波的防守极端侧重内线马上撤下霍华德派上库兹马主动打起了小阵容这套阵容下浓眉或莫里斯对于热火唯一防守优势点阿德巴约在中远距离的牵扯依然存在詹姆斯吸引热火双三号位的作用依然有效那么热火在篮下和外线依然难以兼顾库兹马的空切需要希罗和邓罗延缓外线也就只能依然被放开反之亦然并且这套小阵容更致命的在于他们的防守轮转速度大大提升将不会再像大阵容那样跟不上热火进攻端的团队空手传切体系而且库兹马相比霍华德更广的攻击范围与方式反而更搅乱热火的轮转条理里外里热火内线防守似乎是逼出来了湖人的小阵容内线压力缓解但反而在攻防结合下更亏损了库兹马的空手威胁浓眉的外拉詹姆斯的攻筐出球让阿德巴约带队的换防协防被极度拉扯詹姆斯和浓眉外线双雄拿下了太多抓轮转空隙的分数归根结底这又是资源的劣势热火只有一个强点的前场资源必须被到处调动补墙而后场又缺乏对位向上摇摆能力的钢炮在突击路线卡锁与外线防守上不能完全换防只能稍作延缓后马上回位后场或干脆放空外线而对面的湖人前场的强度厚度高度三绝后场至少也具备回应能力双核巨星詹姆斯兼具攻筐的内线施压与出球的外线连接浓眉全区域覆盖终结拉扯出热火唯一的强点资源或抓轮转缝隙终结回合当湖人甚至能够游刃有余地摆出小阵容却依然能够迫使热火收缩外线回应继续的情况下这场仗是没法打的斯波教练曾经拥有着三巨头而沃格尔教练也曾经带领着平民球队失意于季后赛的巨星篮球之下时过境迁二人或许都没有料想到今日的地位心境之换位到了下半场斯波终于被投疼开始转移防守重心试图兼顾各个区域但这样一来热火局面反而更加窘迫投出了节奏手感自信的湖人后场已经在今晚成了养出来的怪物虽然势必面临适度回调但依然输出足够而内线却开始发挥威力霍华德重新上场后的篮板卡位结合詹姆斯和浓眉等集体高度的冲抢二次进攻内线产效全部升高想要防守住湖人热火需要打出那种绝对完美的团体防守弹性轮转瞬间沟通无碍协防及时阿德巴约需要在最准确的秒数出现在最正确的位置其他人需要在最适当的时候移动到最合理的对位哪怕一秒的空隙都会马上出现资源分配错位的漏洞被狠狠打击以强度轰炸就像今天下半场这样试图兼顾一切的防守只让浓眉在一切区域输出詹姆斯攻筐无敌热火可以做到一个回合两个回合但它需要的是维持全场每个回合让我们离开理想回到现实世界必然无法实现完美防守的热火需要的不是防守由于资源劣势他们竭尽所能也只能是尽量限制失血而已无法真地靠防守赢下比赛想赢而不是硬后的虽败犹荣他们必须把目光转向进攻今天的进攻打的实在太差了我们很难称它为热火的篮球团队型进攻体系大量的空手套路完善的传切多点的威胁就是热火对于湖人的优势所在湖人内线优势最大化的大阵容很难在轮转速度上完全跟上这种进攻这样一来如果热火的火炮们可以团体输出达到对冲防守漏洞失血的坑比赛就变得有所一战更进一步说如果湖人被打到必须侧重防守他们就会上小阵容用打火箭时的隆多卡鲁索库兹马组合提高后场防守在这套阵容里湖人外线的投射稳定性下降主要以隆多的突击路线上球卡鲁索偷溜篮下辅助内线进攻此时热火贯彻放外守内的策略其有效性得到提升而篮下防守的强度劣势也会相对缓解从而在攻防结合上挽回更多而在防守端热火要做的或许就是贯彻方针后的尽力而为如果决定外线放开那么就要坚决在内线侧重资源在内线尽量减少失血至于外线则寄托于天命所归的运势周转相信今天湖人投手的无法稳定回应这当然是赌博押注但热火有限的前后场防守资源也只能用这种方式才有可能至少限制一个区域而不是像今天这样养出外线手感而后又放宽内线双线失守防守端相信天命进攻端团队输出但还是那句话想做到这些热火的团队输出必须拉满甚至突破角色球员的强度天花板这当然很难但至少他们有能力比今天做的更好希罗那些投短的出手邓罗的出手数量阿德巴约的串联有着过于巨大的上升空间了进不进另说至少要先敢投多投打出自己的进攻即尽人事而天命防守端放空环节的失血程度角色球员的爆发程度也要在人事之后才有可能指望具体系列赛分析请移步下回答
学了很久的摄影,湖人是天生的天才球队勒布朗戴维斯天赋都是几十年一遇的热火则是努力型天才球队一堆落选秀组队打进了总决赛天生的天才和努力型天才一碰撞努力型天才就显得那么渺小了戴维斯面对热火任何人都是错位各个位置拿球都是威胁特别是当戴维斯投进三分时估计热火的球员心都是凉的勒布朗不动声色全场予求予取甚至在时间结束后还来背身暴扣往常打总决赛哪还有这力气啊这可能是他生涯以来打得最轻松的一场总决赛了希罗罗宾逊被反复换防勒布朗勒布朗每次都能有所收获不是不努力防不是防守不好就是防不住身体差太多阿德巴约足够拼命在开场面对霍华德时轻轻松松帮助热火领先但是戴维斯站到五号位时阿德巴约再没好过过戴维斯总是后撤一步就欺负阿德巴约没篮子说传吧戴维斯防守面积太大退一步就能覆盖整个禁区巴特勒眼看不对劲只能自己来之前都是到最后才一节才打今天开场就开始拼命突拼命防最后突戴维斯时不慎扭伤热火不是不努力不是战术不行不是人员心不齐他们没有任何问题就是天赋不如别人场上要夹击两个人只能放任湖人外线投篮不然你以为湖人咋投中那么多三分的毕竟让戴维斯和勒布朗在低位要球打那两人的命中率可是有保障的勒布朗戴维斯低位单打那几个球热火没包夹或者包夹不及时两人就稳稳得分热火整场包夹就是赌湖人外线不准结果湖人下半场还是准打到第三节阿德巴约受伤热火内线也崩了努力型天才可以决定下限天生的天才决定的就是上限了
gu gu,之前参加的轮总决赛首战胜率唯一赢得一次还是折戟的今天这场基本是总决赛首战中中赢得最轻松的一场了看了全场比赛两队的硬实力存在明显差距如果热火不变阵本赛季基本就只有三场就闭幕了本场的一些有趣的细节和数据湖人上半场进了个三分创下球队季后赛半场三分记录湖人全场人轮转中除了魔兽其余人全部有三分入账今天外线射爆了热火今天三分中总决赛三分总数达到个超过了汤神的个到达了第二的位置第一名是库里的个湖人全场罚球中命中率高达侧面证明球员罚球时肌肉舒展整体心态比较轻松点名战术再出江湖两个白人后卫希罗和邓罗基本被打爆希罗全场正负值创了历史记录打平科比不过作为今年顺位新秀表现至今没必要责求他更多浓眉面对尺寸前面小一号的热巴从远射到内切抢板二次补篮无所不能热火的反联防被彻底打穿魔兽今天的二次策应令人惊喜至少看到三次接球后二传给浓眉扣篮梦回时的内线中轴角色本场胜利也是魔兽职业生涯的第二场总决赛胜利的表现还是硬气脚受伤回到场上后仍多次突内线全场投中拿下分是热火最强进攻箭头纳恩今天中拿下热火第二高的分虽然有分是在第四节垃圾时间随着德拉季奇的伤病影响下一场斯波会赋予他更多的机会本场赛中热火三大主力都遇到伤病这和热火战术风格和紧密的赛程消耗不无关系德拉季奇被确认为足底筋膜撕裂希望伤病退散斯波教练需要做出回应了阵容高度的差距是最为致命的增加奥利尼克的战术戏份也许会有奇效浓眉在内线的得分实在太轻松了必须收缩内线防守即使放湖人外线也比被内线打穿来的强期待双方第二场对决
VerseVerse也么哥,在之前的文章里我做出了几个有关湖人队的大胆预测浓眉哥势不可挡霍华德可能被再次雪藏詹姆斯阵地战杀伤能力不比以前但在转换进攻里依然极具侵略性朗多关键时刻可堪大用卡鲁索在这种级别的比赛里就不太顶用了我大概看了一下评论争论基本集中在霍华德和卡鲁索这两点甚至有球迷朋友引用静墨易的论点认为湖人的取胜关键点就是大阵容那么真的是这样吗当我得知霍华德今天首发出场的时候心里已经做好准备被球迷朋友们啪啪打脸了然而比赛开始后热火队迅速地取得的领先又在我心底升起了一丝侥幸由于霍华德防不出去热火队的外线火力点得到了较为舒适的出手空间而霍华德在内线的存在感也远不如许多球迷想象得那么强烈很奇怪的一点是很多球迷误以为阿德巴约是个内线糙哥实际上他除了射程不到三分线其他技术特点都是典型的新式小球内线篮球比赛不是五个对加在一起它是整体攻防体系的对决拼的不只是天赋还有执行力和应变霍华德顶防约基奇的时候效果明显但面对更加灵活的阿德巴约他远不如浓眉哥更有影响力于是暂停回来后霍华德下去了换脚步更快的浓眉守护内线湖人队锁三分阻截热火的空切结果半场比赛结束湖人反倒领先了热火分等到第三节巴特勒德拉季奇阿德巴约都伤了热火队的强度下去了以后霍华德的作用才开始逐渐体现当然如果阿德巴约在之后的比赛里继续缺席我也十分赞同给霍华德和麦基更多的出场时间卡鲁索今天的表现是超出我预期的他的追防很不错但是在防守细节上还需要积累经验防守关键球的时候喜欢下手切球这点弄不好容易惹出大麻烦来但至少从今天的比赛来说卡鲁索没有太多暴露出自己的问题反倒在进攻端打出了一些亮点因此我需要跟卡鲁索的球迷道个歉和我之前预测的一样浓眉哥在这轮系列赛里果然还是无解的他在首节就砍下了分半场分篮板助攻高效且稳定在热火队开场打出气势的那段时间里他和詹姆斯是湖人队少数能给出回应的点霍华德和詹姆斯一起下去休息的时候湖人队的小阵容也是仰仗于戴维斯的禁区影响力才敢大胆地锁三分线哪怕不看正负值戴维斯也是本场的无疑如果阿德巴约无法以最好的状态迎接接下来的高强度比赛热火队的勤奋是否还足以弥补上天赋的差距呢从热火队的现有阵容里找出一个替代者补上阿德巴约的空缺是不太可能的变阵的话就要看斯波教练手里到底还藏着什么底牌了欢迎大家关注我的微信公众号审判也么哥持续为您献上更多精彩文章
离去去,詹姆斯真的没发力比赛结束后还来一个暴扣说明真的手痒痒没打过瘾这赛季老詹基本没了等下一个赛季的勇士吧健康的水花一个未知的球星还是很强的能激活全力詹
sola,湖人总冠军
